ID,Title,Location,Salary,Summary
https://kr.indeed.com/viewjob?jk=833a4d9bb5840b70,Senior Data Scientist (Korea),FPT Software 대한민국,,"deploy custom code in a variety of environments ( Python, SAS, R, etc.) to create predictive analytics applications. Use..."
https://kr.indeed.com/viewjob?jk=43f8edb38c7888c7,위메프오 서버개발자(정규직),위메프 2.8 대한민국,,"데이터베이스 분산설계 및 미들웨어 개발 [자격사항] - 서버 프로그래밍 언어(PHP, Go, C/C++, Python, Java) 중 1개 이상 사용이 가능한 분 - 자료구조, 알고리즘, 분산처리 등 SW관련 기본지식 보유..."
https://kr.indeed.com/viewjob?jk=6b86ea39985912b6,NHN Cloud 사업기획/영업,NHN 4.4 성남 판교역,,"Linux, Microsoft Solutions 등) - 2년 이상의 개발 경험 (Java, Python 등) - 기술 문서 작성 및 가이드 경험이 풍부한 자 - 대외 고객 기술 지원 경험 공통지원자격..."
https://kr.indeed.com/viewjob?jk=d585814d097935eb,카카오톡 보이스톡/페이스톡/라이브톡 개발자 모집,카카오 4.0 성남 판교역,,"우대 사항 ✓ Spring/Java 혹은 Spring/Kotlin 기반 서버 개발 경험 ✓ MySQL, Python, JavaScript, Node.js 경험 ✓ 모바일/웹 환경을 위한 API 시스템 개발 경험 ✓ k8s..."
https://kr.indeed.com/viewjob?jk=0f139e8552caa762,매치메이킹 서버 개발,Nexon 성남 분당구,,"습니다. - AWS ECS - AWS Lambda - Go - Python - Redis 사용자의 몰입도를 높이는 매치메이킹 규칙을 구현합... 원자격 -한 가지 이상의 개발 언어( Python, C++, C#, Go 등..."
https://kr.indeed.com/viewjob?jk=619fba05d132ccb1,Camera Essential Feature Designer - Came...,Qualcomm Korea YH 경기도 수원,,debugging tools for multimedia applications (Matlab/ Python etc) · Software verification and validation for approvals testing...
https://kr.indeed.com/viewjob?jk=14d562d10c215572,"PHP, Python 신입/경력 정규직",비즈부스터 서울 금천구,,"주식회사 비즈부스터 PHP, Python 개발자 채용 모집부문 및 자격요건 담당업무 자격요건 인원 [담당업무]*당사의 서비스(비즈탑) 솔루션 및 서비... 프로그래머>PHP |인터넷·IT·통신·모바일·게임>웹프로그래머> Python"
https://kr.indeed.com/viewjob?jk=ddc8b97dbb54574d,전장부품사업부 신입(석사)/경력사원,LG이노텍 4.1 서울 마곡역,,"컴퓨터/소프트웨어공학 전공자 (신입은 석사, 경력은 학사 이상 학위 소지자) - C/C++/MFC, Python, Matlab 프로그램 가능자 - 영상/신호처리/ISP개발 유경험자 - Business 영어회화 가능자..."
https://kr.indeed.com/viewjob?jk=a797f3892b4cb82f,프로덕트 데이터 분석가 영입,카카오페이 성남 백현동,,분 - SQL 등을 통해 복잡한 데이터 셋에서 원하는 데이터를 추출 및 가공할 수 있으신 분 - R 또는 Python을 활용하여 분석 및 결과 리포팅이 가능하신 분 - 분석을 통해 도출된 의견을 논리적이고 체계적으로...
https://kr.indeed.com/viewjob?jk=65e2b1371687bc18,[전문연구요원] 데이터 인프라 개발자(신입/경력),웹젠 성남 분당구,,과정 수료자 포함 ) 로서 전문연구요원 신규편입 / 전직 대상인 분 - Python 또는 C# 프로그래밍 능력 - Linux 환경에서 개발 및 운영... 신규편입 / 전직 대상인 분 - Python 또는 C# 프로그래밍 능력...
https://kr.indeed.com/viewjob?jk=fb7671cb525c01d4,2021년 5월 경력사원,세메스 천안 서북구,,"역량 (C++, Python, Vision Library 등) AI... 머신러닝, 데이터마이닝 기반 데이터 분석 시스템 개발 경력 Python, R, SAS 등 프로그래밍 경력 부품 표준화 Etch/물류..."
https://kr.indeed.com/viewjob?jk=d41bc3797321bc87,Field Application Engineer,ASML 대한민국,,Linux/Unix OS - Preferredto have high-level programming skill for python and lualanguage. *Working Location : Icheon
https://kr.indeed.com/viewjob?jk=617dbecdabad02b9,"NAVER, LINE 서비스 플랫폼 운영",엔아이티서비스 성남 분당구,,"언어( python, java, c언어 등) 초급 수준인 분[우대사항]- Docker(kubernetes) 관련 지식 보유 및 활용 경험- Linux System, WEB/WAS, DB운영 경험- 프로그래밍 언어( python..."
https://kr.indeed.com/viewjob?jk=adfabdc55940347c,"Python 신입/경력 정규직, 계약직",에이피에스티 서울 강서구,,인터넷·IT·통신·모바일·게임>응용프로그래머> Python
https://kr.indeed.com/viewjob?jk=0efead5f23089faa,LB그룹 2021년 상반기 대규모 수시 및 연계형 인턴,한국아브노바 서울 영등포구,,통신·모바일·게임>빅데이터·AI(인공지능)>딥러닝|인터넷·IT·통신·모바일·게임>빅데이터·AI(인공지능)> Python|마케팅·광고·홍보·조사>마케팅>마케팅기획|마케팅·광고·홍보·조사>마케팅>해외마케팅|마케팅·광고·홍보·조사...
https://kr.indeed.com/viewjob?jk=e4e7e2e0d73f981f,Data Scientist,Barbaricum 경기도 평택,,"Tools, and Techniques Demonstrated proficiency with R or Python, and SQL to manipulate data and draw insights from large..."
https://kr.indeed.com/viewjob?jk=797fdeaf345bd03b,Camera ISP Tuning Engineer - Camera (QCT...,Qualcomm Korea YH 경기도 수원,,"processing Experience with C, C++, Python Experience with camera image quality... e.g., C, C++, Python), computer..."
https://kr.indeed.com/viewjob?jk=18b0485ce0c5d17e,2021년 상반기 경력직 수시,SBI저축은행 서울 중구,,VoIP|인터넷·IT·통신·모바일·게임>응용프로그래머>API|인터넷·IT·통신·모바일·게임>응용프로그래머> Python|인터넷·IT·통신·모바일·게임>시스템프로그래머>펌웨어·어셈블러|인터넷·IT·통신·모바일·게임>데이터베이스...
https://kr.indeed.com/viewjob?jk=34aa73444326ccb4,[기술부문/QA] 티맥스그룹 2021년 상반기 특별 (신입 및 경력),티맥스소프트 성남 분당구,,"상세] ㆍ 보유기술: Java, python, RDB, NoSQL, OS... CKA ㆍ 경험: RHEL, CentOS, Shell script, Python, AWS, Google Cloud 모집기간 2021/05/24..."
https://kr.indeed.com/viewjob?jk=687b9e16f739c6bc,데이터 분석 및 컨설팅분야 (경력직),한국정보기술단 과천 과천시,,"데이터 분석 및 컨설팅 분야 ( Python, SAS, 빅데이터) 경력직... 데이터분석|인터넷·IT·통신·모바일·게임>빅데이터·AI(인공지능)> Python|인터넷·IT·통신·모바일·게임>빅데이터·AI(인공지능)>R|인터넷..."
https://kr.indeed.com/viewjob?jk=c71c1fa9e0d43937,악성코드 및 엔드포인트 위협 대응 보안 엔지니어 모집,카카오 4.0 성남 판교역,,"경력 3년 이상 Windows, OSX, Linux 시스템 조사 가능자 Python, node.js 언어로 개발 가능자 다양한 보안 제품에 대한 경험... API 활용 SOAR 구성 Python/Linux shell script..."
https://kr.indeed.com/viewjob?jk=babd416604674640,DX(Digital Transformation)분야 경력사원 (법인Sta...,LG화학 서울특별시,,"패키지(SQL, SAS, R, Python, Spark) 사용가능 또는... 높은 이해 - 데이터 관련 플랫폼 기술에 대한 높은 이해 - R, Python, C/C++, Java 등 프로그래밍 언어 이해 경력사항 (관련 경력..."
https://kr.indeed.com/viewjob?jk=740c1e94e04818f0,연구소 개발부문 연구원 직원 (회로설계/하드웨어설계/머신비전/이미지프로세...,모든 경기도 광명,"연봉 42,000,000원 - 46,000,000원","프로그래밍 가능자 우대S/W 설계 부문 : - OPEN CV, TENSORFLOW, YOLO, CUDA/ Python, C++, C WindowsGUL APL, MFC Lib 활용 가능자. 머신비전/ 영상처리 개발자* 전기..."
https://kr.indeed.com/viewjob?jk=2b2dcd3ffe3d53df,카카오 데이터의 가치를 발굴할 데이터 분석가 모집,카카오 4.0 성남 판교역,,"기술 통계량 이해 및 해석) 데이터 분석 업무를 수행할 수 있는 언어 스킬 필수 SQL 필수 R 또는 Python을 다룰 수 있는 분 (SAS, SPSS, GA, tableau 등 통계 툴만 사용 가능한 경우 제외) 하둡..."
https://kr.indeed.com/viewjob?jk=da5d4dd560fb6f85,Data Scientist,Garrett Advancing Motion 경기도,,"System/Data Integration • High level programming skills ( Python, R, Matlab, C++ or Java) • Machine Learning Algorithms..."
https://kr.indeed.com/viewjob?jk=f069d006ba3ffa5a,(신입/경력) AR&AI 엔지니어,플레이스에이 성남 분당구,,"Engine 중 1개 이상 능숙하게 다룰 수 있다 - C, C++, Python 등 프로그래밍 언어 중 1개 이상 능숙하게 다룰 수 있다... 다룰 수 있다 - C, C++, Python 등 프로그래밍 언어 중 1개..."
https://kr.indeed.com/viewjob?jk=f5aedcc54a200062,(대기업) 디지털솔루션 기술영업/사업개발,인코리아 프로페셔널 성남 분당구,,바일·게임>빅데이터·AI(인공지능)>토탈제어시스템|인터넷·IT·통신·모바일·게임>빅데이터·AI(인공지능)> Python|인터넷·IT·통신·모바일·게임>빅데이터·AI(인공지능)>인공지능(AI)|인터넷·IT·통신·모바일·게임>빅데...
https://kr.indeed.com/viewjob?jk=bc1be4ffc953c21a,Quality Engineer 반월공장 (Precursor & Speci...,Merck KGaA Darmstadt Germany 경기도 안산,,"analysis. Background in programming ( Python, Java script, SQL) is preferred... preferred ( Python, Java script, SQL..."
https://kr.indeed.com/viewjob?jk=e5448ffc7d6ecf02,FPGA 플랫폼 엔지니어 (딥러닝 하드웨어 프로세서 개발),딥엑스 성남 분당구,"연봉 40,000,000원 - 100,000,000원","사용 경험(Chip Scope/SignalTap) - Language: Python/Perl, C/C++ - Vivado 또는 Synplify 또는... SignalTap) - Language: Python/Perl, C/C++..."
https://kr.indeed.com/viewjob?jk=91d07b599ebcef9c,[웹젠] 데이터분석(경력),웹젠 성남 분당구,,DW 및 BI 경험이 있는 분 ﻿ 우대사항 - Linux 환경에서 Python 언어로의 개발이 가능한 분 - 데이터 분석 및 활용에 관심이 높은 분... 우대사항 - Linux 환경에서 Python 언어로의 개발이 가능한 분...
https://kr.indeed.com/viewjob?jk=8248de2f3c41ef06,Data Analyst,Barbaricum 경기도 평택,,"3 years of experience. Documented proficiency with R or Python, and SQL to manipulate data and draw insights from large..."
https://kr.indeed.com/viewjob?jk=215560c82215171d,(주)이루텔럭키 소프트웨어개발자,이루텔럭키 경기도 군포,,"MS SQL, Oracle, MySQL 등 DBMS 설계 및 운영 가능자 - 웹, DB서버 구축 및 유지 가능자 인터넷·IT·통신·모바일·게임>웹프로그래머>JAVA|인터넷·IT·통신·모바일·게임>웹프로그래머> Python"
https://kr.indeed.com/viewjob?jk=5528965f86b8cb00,[뉴플랫폼기술] 클라우드 아키텍트,한국카카오은행 성남 분당구,,인터넷·IT·통신·모바일·게임>응용프로그래머>클라우드|인터넷·IT·통신·모바일·게임>응용프로그래머> Python|인터넷·IT·통신·모바일·게임>통신·모바일>플랫폼(VM)|인터넷·IT·통신·모바일·게임>웹프로그래머> Python
https://kr.indeed.com/viewjob?jk=1ce21b2af70e0407,연구소 개발부문 연구원 직원 (회로설계/하드웨어설계/머신비전/이미지프로세...,모든다해 경기도 광명,"연봉 42,000,000원 - 44,000,000원","프로그래밍 가능자 우대 S/W 설계 부문 : - OPEN CV, TENSORFLOW, YOLO, CUDA/ Python, C++, C WindowsGUL APL, MFC Lib 활용 가능자. 머신비전/ 영상처리 개발자 * 전기..."
https://kr.indeed.com/viewjob?jk=6203061bca6094ec,Data Analyst,뱅크샐러드 서울 영등포구,,"가지신 분 Business Intelligence 시스템 및 비즈니스 리포팅 툴의 활용 능력 프로그래밍 언어( Python/R, etc)를 활용하여 데이터 분석이 가능하신 분 더 나은 데이터 기반 서비스를 만들기 위해 동료들과..."
https://kr.indeed.com/viewjob?jk=8dbaea1ef73ca163,2021 경력직 대규모,휴머스온 서울 강남구,,그래머>Ruby|인터넷·IT·통신·모바일·게임>웹프로그래머>프론트엔드|인터넷·IT·통신·모바일·게임>웹프로그래머> Python|인터넷·IT·통신·모바일·게임>웹프로그래머>ASP.NET|인터넷·IT·통신·모바일·게임>웹프로그래머...
https://kr.indeed.com/viewjob?jk=abe9817564d21e63,[단기계약직] 독립실행형 음성인식 기술 테스트 업무자 모집,엔씨소프트 2.7 성남 판교역,,0년 필수조건 - 머신러닝을 주제로 한 대화가 가능해야 함. - 테스트시 사용할수 있는 프로그래밍 능력( Python) 우대사항 음성인식 분야 전공자 음성인식기 개발 및 성능 최적화 경험자 Android/iOS 앱 개발 경험자...
https://kr.indeed.com/viewjob?jk=69ab0f58743cb713,21년 전문연구요원 (AI엔지니어),Nexon 성남 분당구,,"대상자 - 병역의무가 없거나 면제된 분, 병역의 의무를 마치신 분은 본 공고의 대상에서 제외됨 - Python에 숙련된 프로그래밍 능력과 머신러닝 라이브러리 활용 경험 - 머신러닝과 강화학습에 관련된 지식 습득 혹은..."
https://kr.indeed.com/viewjob?jk=1806287902a1a36e,[데이터센터] (경력/신입) 카카오 데이터센터 Data Scientist...,카카오 4.0 성남 판교역,,"않고, 기술이 비즈니스 가치로 변모할 수 있는 그 가능성에 집중합니다. 지원자격 필수사항 Go, Python, Scala, Java, C/C++ 중 하나 이상의 언어에 능숙하신 분 SQL 또는 HiveQL에 능숙하신..."
https://kr.indeed.com/viewjob?jk=78e99625e5de3c95,전문연구요원 (병역특례) 수시 (AI / HW 분야),딥엑스 성남 분당구,"연봉 40,000,000원 - 100,000,000원","모델의 RTL IP 설계 및 IP 검증 가능자 - Language: Python/Perl, C/C++ [우대 조건] - ARM based SoC 설계... Linux, shell, tcl, python, perl 사용 원활..."
https://kr.indeed.com/viewjob?jk=c16db6828cb26848,"자바스크립트, Python 신입/경력 정규직",데이터누리 서울 강서구,,"(주)데이터누리 자바스크립트, Python 신입/경력 정규직 채용 모집부문 및 자격요건 담당업무 자격요건 인원 JAVA / Python 개발 [자격요건]경력... 래머>자바스크립트|인터넷·IT·통신·모바일·게임>응용프로그래머> Python"
https://kr.indeed.com/viewjob?jk=0064deb5fa9cbce0,데이터 사이언티스트 모집,카카오 4.0 성남 판교역,,"양한 실험을 통해 알고리즘을 개선합니다. 지원자격 지원자격 하나 이상의 프로그래밍 언어에 익숙한 분( Python, Java, C/C++, Scala 등) 머신러닝/딥러닝 오픈소스를 이용하여 1년 이상 특정 서비스에 모델..."
https://kr.indeed.com/viewjob?jk=55584c627df1acaa,데이터 분석가/사이언티스트(신입/인턴 가능),쏘카 제주도 제주,,"Sheet) 등 데이터 분석 도구를 원활히 다루시거나, 앞으로 원활히 다루고자 하는 의지가 높으신 분 • Python, R 등의 프로그래밍 언어 혹은 데이터 분석 언어를 1개 이상 능숙하게 사용 가능하신 분 전형절차 서류..."
https://kr.indeed.com/viewjob?jk=0c4a502533e74aac,"Research Intern, 2021",Google 4.3 서울,,"Algorithmic Foundations of Optimization. Experience with Python, C++ and other general purpose program languages. Preferred..."
https://kr.indeed.com/viewjob?jk=07375dc4e800dfa9,추천 시스템 소프트웨어 엔지니어,카카오 4.0 성남 판교역,,"관련 업무 경험자 우대사항 운영체제, 네트워크, 컴파일러, 데이터베이스에 대한 이해가 깊으신 분 Python, C++, GPU 프로그래밍 숙련자 대용량/실시간 서비스 개발/운영 경험이 많으신 분 ICPC/TopCoder..."
https://kr.indeed.com/viewjob?jk=be6c1f03fa566f8e,추천 시스템 연구/개발,카카오 4.0 성남 판교역,,"분야 석사 또는 박사 학위 소지자 적어도 하나 이상의 능숙한 프로그래밍 언어가 있으신 분 우대사항 Python, C++, GPU 프로그래밍 숙련자 TensorFlow, PyTorch, implicit 등 머신러닝/추천..."
https://kr.indeed.com/viewjob?jk=ac9068957c550cb3,데이터 전문가(모델러/분석가/엔지니어) 모집,카카오 4.0 성남 판교역,,대용량 데이터를 효율적으로 사용하기 위한 기반 데이터 가공 지원자격 데이터 사이언스를 위한 언어(R/ Python/Scala) 및 도구(scikit-learn/Spark MLlib/Tensorflow/Pytorch 등)를...
https://kr.indeed.com/viewjob?jk=787985a3bf3a781b,"GIS 공간정보 구축, S/W개발, 기술영업",엔토포스 안양 동안구,,5.10p 인터넷·IT·통신·모바일·게임>웹프로그래머>JAVA|인터넷·IT·통신·모바일·게임>웹프로그래머> Python|인터넷·IT·통신·모바일·게임>응용프로그래머>C#|인터넷·IT·통신·모바일·게임>소프트웨어·하드웨어>소프트웨어
https://kr.indeed.com/viewjob?jk=605561cceb1d698c,(대기업) Data 분석 및 개발,인코리아 프로페셔널 성남 분당구,,"팀원, 대리, 과장 [자격요건]경력사항: 신입, 경력(12년 이하)- Python 개발경험 (2년 이상 우대) - 이미지 또는 시계열 데이터 이해가능... 게임>빅데이터·AI(인공지능)> Python|인터넷·IT·통신·모바일·게임..."
https://kr.indeed.com/viewjob?jk=bfe0f5ac4f32ec89,추천 통계분석/데이터사이언티스트,카카오 4.0 성남 판교역,,"통계, 수학 관련 분야의 석사 또는 박사 학위 소지자 숙련된 데이터분석 능력 데이터 사이언스를 위한 언어( Python/R) 를 하나 이상 능숙하게 다룰 수 있으신 분 분석 결과를 설득력있게 전달할 수 있는 분 우대사항..."
https://kr.indeed.com/viewjob?jk=ce34ff03a6fc4bab,한림대학교성심병원 빅데이터센터 경력직 채용공고,한림대학교성심병원 대한민국,,"가. 관련업무 학사 이상 학위 취득자(대졸 이상 4년) 나. NoSQL, Oracle, Sybase, R, Python 가능자 우대 다. Common Data Model 경험자 우대 라. 서버관리/정보보안, 텍스트마이닝 경험..."
https://kr.indeed.com/viewjob?jk=33d60dd4aa7e220b,[웹젠] 게임보안(경력),웹젠 성남 분당구,,PC/AOS/IOS 어플리케이션 리버싱 가능한 분 - C/C++/ Python/Java 등 개발 능력을 보유한 분 - 암호화 / 네트워크 /DB 등... 리버싱 가능한 분 - C/C++/ Python/Java 등 개발 능력을 보유...
https://kr.indeed.com/viewjob?jk=3d0cc83899a9b37f,[개발]CI/CD 엔지니어(정규직),위메프 2.8 대한민국,,"배포 경험이 있는 분 [우대사항] - kubernetes 기반 서비스 운영경험이 있는 분 - JAVA, python 등 웹어플리케이션용 개발언어 1개 이상 경험이 있는 분 - 네트워크, 리눅스 기반 관련 지식 보유한 분..."
https://kr.indeed.com/viewjob?jk=0e25fc2e43547710,검사 자동화 및 검사AI 분야 경력사원,LG이노텍 4.1 경기도 평택,,"C++,Labview, R, Python 등 ) - AI 관련학과 전공 및 검사공정 AI 경력 3년이상 보유자 (딥러닝 모델설계/학습/배포, 딥러닝 성능 개선 ) - Python 언어와 딥러닝 프레임워크 (Tensorflow..."
https://kr.indeed.com/viewjob?jk=392272f583594fd9,대기업 딥러닝 기반 영상처리 개발자 ( 판교),인파트너스 서울,,"Pytorch- Python, C/C++, Docker C/C++/C#... 머신러닝|인터넷·IT·통신·모바일·게임>빅데이터·AI(인공지능)> Python|인터넷·IT·통신·모바일·게임>시스템프로그래머>임베디드(Embedded)"
https://kr.indeed.com/viewjob?jk=9040dba1c8db2a5d,퀀트운용팀 (사원-대리급),신한비엔피파리바자산운용 대한민국,,지식 보유자 - 투자자산운용사 자격증 소지자 우대 - CFA/CAIA/CPA 자격증 소지자 우대 - VBA/ Python 활용한 업무 가능자 우대 - 관련 전공 및 석박사 학위/금융 관련 자격증 보유자 우대 3. 전형방법...
https://kr.indeed.com/viewjob?jk=22fce0a32d1b021c,Corporate Application Engineer – Calibre...,Mentor Graphics (Korea) LLC 4.0 경기도 성남,,"Linux OS, and previous experience with scripting or Tcl/ Python/Perl programming preferred Familiar with Siemens EDA’s Calibre..."
https://kr.indeed.com/viewjob?jk=7cb5c3076d1701db,"Field Applications Engineer, Audio",Dolby 서울,,"High level or detailed knowledge of SOC design. C/C++, python coding skills. Knowledge of music, audio/video production..."
https://kr.indeed.com/viewjob?jk=ef05281bd02652a8,Data Analyst,Toss 서울 강남구,,"소지하신 분 혹은 경험이 풍부하신 분 - Data Warehouse 구축 지식이나 경험이 있으신 분 - Python, R, Spark 등 언어 및 데이터 프로세싱 프레임워크에 대한 이해도가 높은 분 - 필요한 데이터를 스스로..."
https://kr.indeed.com/viewjob?jk=560e023c83a9bb6c,"Technical Operations Manager, Premium Su...",Amazon Web Services Korea LLC 서울,,Programming in one or more... following languages - Java/ Python/ Ruby/ .NET/ Android/ iOS · Must have excellent oral...
https://kr.indeed.com/viewjob?jk=f78288e880673af0,Software Engineer - Test,Roku 서울,,"experience... least one of following programming languages: Python, Ruby, Java, C++. Experience in multiple languages..."
https://kr.indeed.com/viewjob?jk=d017610d9828199c,"드론 데이터 스타트업, 엔젤스윙 엔지니어",엔젤스윙 서울 관악구,,"Ruby on Rails, Python, C++, AWS AWS, GCP... 기반 웹서비스 개발 경험 디버깅, 최적화 스킬 Javascript, Python, C++ 등 개발언어 중 자신있는 언어가 1가지 이상 있으신 분..."
https://kr.indeed.com/viewjob?jk=b4c6146c52b4dc2b,(주)테라젠바이오 데이터과제팀 계약직,테라젠바이오 수원 영통구,,"등 한 가지 이상의 Back-end Framework 경험 - Git 등의 협업 툴 사용 우대사항: - Python 사용 경험 - Linux 숙련자 - 컨테이너(Docker, k8s), 클라우드 경험 0 명 근무조건 고용형태..."
https://kr.indeed.com/viewjob?jk=4040bdbc5e27e13d,[웹젠] TA(Unreal Engine 4)(경력),웹젠 성남 분당구,,"티스트를 위한 툴 제작 및 각종 기술 문서 작성 (Blueprint, python, maxscript) - 아트 컨텐츠 관련 이슈 해결 및 기술 지원... 문서 작성 (Blueprint, python, maxscript) - 아트..."
https://kr.indeed.com/viewjob?jk=af1b1800c6df998a,침해시도 분석/대응 전문가,이베이 코리아 서울 강남구,,"경험 - Firewall/IPS/Botnet 탐지 솔루션 구축/운영 경험 - 업무 자동화를 위한 개발 ( Python 등) 스킬 보유 - Splunk, Elastic 활용 경험 - Private/Public Cloud 환경의..."
https://kr.indeed.com/viewjob?jk=a9cdc775704ea238,코어 시스템 DevOps 엔지니어,Nexon 성남 분당구,,"경험이 있으신 분 - C++, C# 언어 사용에 능숙하신 분 - 스크립트 언어(Powershell, Python 등) 사용 경험이 있으신 분 - Android와 iOS등 모바일 플랫폼 빌드 및 배포 파이프라인에 대한..."
https://kr.indeed.com/viewjob?jk=79ac23969bbd20ba,Computer Vision 개발자,인텔리코리아 서울 금천구,,채용이 취소될 수 있습니다. 인터넷·IT·통신·모바일·게임>빅데이터·AI(인공지능)>머신러닝|인터넷·IT·통신·모바일·게임>빅데이터·AI(인공지능)>딥러닝|인터넷·IT·통신·모바일·게임>빅데이터·AI(인공지능)> Python
https://kr.indeed.com/viewjob?jk=4cd34228af5013fd,DGIST 2019년 제1차 계약직원 공개채용 공고,대구경북과학기술원 대구 현풍면,,"우수자(SPSS, R 등 통계패키지) 외국어(영어) 구사 능력 우수자 Programming(MATLAB, Python, C/C++ 등) 가능자 · 근무기간 : 2019.3.11.~2020.3.10. ※ 단, 재계약 평가에..."
https://kr.indeed.com/viewjob?jk=3d6c266ae2b4771e,[카카오맵] 검색/추천 개발자 모집,카카오 4.0 성남 판교역,,"로그 분석 품질 개선점 도출 사용자 피드백 분석 로그 분석 시스템 개발 지원자격 사용하는 기술셋 Python, Java Flask, Spring ML, Pandas SQL, Spark, Hadoop Echo System..."
https://kr.indeed.com/viewjob?jk=894076a3c4144608,대기업 카메라 ISP설계 SoC설계 및 검증,국내 대기업 / 3500억 매출 / 방송장비 제조업 성남 판교역,,"Language 필수, Python 가능 - Image Processing... 설계, System-Verilog 및 UVM 설계 - C/C++, Python 가능, Timing report 분석 가능(DC, PT) - 3년이상..."
https://kr.indeed.com/viewjob?jk=3933762f9f06df56,Data Scientist(CSS 모델링),Toss 서울 강남구,,"3년 이상) - 머신러닝 등 최신 알고리즘을 활용하여 실제 비즈니스 문제 해결 경험이 있으신 분 - SQL, Python, R 등 통계/분석 프로그램을 다룰 수 있으신 분 # 우대 사항 - 금융권 데이터 분석 및 모델링 업무..."
https://kr.indeed.com/viewjob?jk=c52f854a9841881c,개인화메시징,Nexon 성남 분당구,,"성장해나갈 분을 찾고 있습니다. 지원자격 - 논리적, 분석적 사고력 - 실험 설계, 통계학 지식 - Python, SQL, Spark 등을 사용한 데이터 전처리, 분석 경험 우대사항 - 다양한 장르의 게임을 깊이 있게..."
https://kr.indeed.com/viewjob?jk=1f5ee210162622c9,챗봇 개발자,에스알유니버스 서울 마포구,"연봉 30,000,000원 - 35,000,000원","경력사항: 신입, 경력(연차무관)학력사항: 대학교(4년)졸업직무기술: Python, Linux, 자연어처리(NLP), 인공지능 챗봇, 인공지능 (AI... 게임>빅데이터·AI(인공지능)> Python|인터넷·IT·통신·모바일·게임..."
https://kr.indeed.com/viewjob?jk=2892c67308e87f01,Field Data Scientist,Success Korea 경기도,,"Scripting experience required (e.g. Matlab, R, Python). Familiarity with analytics... e.g. Matlab, R, Python). Familiarity..."
