ID,Title,Location,Salary,Summary
https://kr.indeed.com/viewjob?jk=c130ad24ffc25b72,기술연구소 (AI연구 및 Python개발 / 드론 영상처리),선영종합엔지니어링 고양 덕양구,,어링 기술연구소 (AI연구 및 Python개발 / 드론 영상처리) 채용 4... 프로그래밍 ㆍBig Data 활용 및 Smart plant ㆍR 및 Python 기반 프로그램 개발 ㆍ정부출연사업 제안서 작성 [근무부서 및 직급...
https://kr.indeed.com/viewjob?jk=fae02f1199fdd983,2분기 게임 클라이언트 개발자 채용 (신입/경력),이스트게임즈 서울 서초동,,"C/C++, C#, Swift, Objective C, Kotlin, Java, JavaScript, Python, Go. -새로운 프로그래밍 언어를 습득하는데 어려움이 없거나 혹은 흥미를 갖고 있는 분 -게임엔진 사용..."
https://kr.indeed.com/viewjob?jk=c39d18040425ef53,PostgreSQL 운영 및 데이터베이스 관리자 모집,카카오 4.0 성남 판교역,,"청하고 잘 이해하는 분 Database 운영 유경험자 ( PostgreSQL 운영 경험이 있으신 분 우대) python, go, bash 등 개발 경험이 있는 분 우대 클라우드 환경의 DB시스템 구축 및 운영 경험이 있는 분..."
https://kr.indeed.com/viewjob?jk=d8a8869ab092f731,데이터 엔지니어 및 사이언티스트,카카오 4.0 성남 판교역,,"등 데이터 엔지니어와 사이언티스트의 업무를 경계 없이 수행하게 됩니다. 지원자격 개발 경력 3년 이상 Python, Scala, Java, C++ 중 하나 이상의 언어에 능통 SQL 또는 HiveQL에 능통 대용량 데이..."
https://kr.indeed.com/viewjob?jk=eaee1538d8cc832f,메시지발송 플랫폼 개발자,Nexon 성남 분당구,,"개발 가능하면서 python 개발 경험 소유자(또는 Python 개발 가능... NET 또는 python 개발 경력 5년이상 - 자동화를 위한 스크립트(powershell, bash, python 등) 경험 - Windows..."
https://kr.indeed.com/viewjob?jk=aeb47694b1e660ff,[L'Oreal Korea] Data Analyst,L'Oreal 4.1 서울,,achieve target outcomes Proficiency in SQL and one of Python or R Strong understanding and hands-on experience in data...
https://kr.indeed.com/viewjob?jk=afe92c03320fe1b3,카카오 광고 서비스 알고리즘 및 시스템 개발,카카오 4.0 성남 판교역,,"함께 하고 싶습니다. 지원자격(공통) 하나 이상의 프로그래밍 언어에 익숙한 분 (C/C++, Java, Python, Go, Scala 등) [알고리즘 개발 업무 관련 지원 경우] 데이터 마이닝 또는 머신러닝 지식/경험이..."
https://kr.indeed.com/viewjob?jk=a47b7e97d5e45c9c,TEAM LEAD,Harman International 경기도,,"your technology knowledge in Product Security, Android, Python, System, Software, and Hardware Architecture, and System..."
https://kr.indeed.com/viewjob?jk=368e303e15b6bdb7,AI Engineer,GE Appliances 경기도 성남,,"lite, TensorRT. 5+ years of programming experience in Python, C/C++ Experiences working on deep learning model optimization..."
https://kr.indeed.com/viewjob?jk=7bf179a290a157b2,경험최적화파트 - 머신러닝 엔지니어,Nexon 성남 분당구,,모델 개발 - 머신러닝을 위한 솔루션 프로토타이핑 - 머신러닝 파이프라인 설계 및 구축 지원자격 - Python에 숙련된 프로그래밍 능력과 머신러닝 라이브러리 활용 경험 - 머신러닝과 강화학습에 관련된 지식 습득 혹은...
https://kr.indeed.com/viewjob?jk=cd40cf786e32f325,사내 및 서비스 보안 담당자 (경력),네오위즈 대한민국,,"GuardDuty, WAF, VPC Flow Logs 분석 등)이 있으신 분 - 각종 스크립트 언어(Perl, Python, shell script 등)의 활용 능력을 가진 분 - 모바일 게임 앱에 대한 보안 검수 경험이..."
https://kr.indeed.com/viewjob?jk=4207c3ceb2dad58c,[EY한영] 금융감사본부 Data Analytics 전문 경력직 모집,EY 4.0 대한민국,,총계정원장조정 경험자 - Python/R 등 프로그램 언어 활용 능력... PowerBI... Tableau Experience with Python/ R or other programming languages...
https://kr.indeed.com/viewjob?jk=c0e0dfb0e7ae9f7f,연구센터 데이터 엔지니어 경력자,LG전자 3.8 서울특별시,,"Linux 개발 환경에 익숙하고, Python 혹은 Java 등 프로그래밍... 데이터 파이프라인 및 솔루션을 설계하고 구축한 경험 우대 사항 - Python Data & Analytics 라이브러리 경험 (NLTK, Spacy..."
https://kr.indeed.com/viewjob?jk=5e7dc1196f13b938,"NAVER, LINE 서비스 플랫폼 운영",NIT Service 성남 삼평동,,"유하신 분 - 프로그래밍 언어( python, java, c언어 등) 초급... System, WEB/WAS, DB운영 경험 - 프로그래밍 언어( python, java, c언어 등) 중급 이상 - 국가보훈대상자 및 장애인은..."
https://kr.indeed.com/viewjob?jk=4bfb17b42e2d7728,Field Algorithm Engineer,Nova Measuring Instruments 경기도 화성,,long periods of time (up to 1 month each time). Programming – python proficient. Machine learning and data science experience...
https://kr.indeed.com/viewjob?jk=29c2dde14b3c31d3,R&D 연계형 석사 신입 인턴십 수시,실리콘웍스 대전 유성구,,"압축 알고리즘 개발 - 정량/정성 화질 분석 및 평가 - Implementation:C, Matlab, python Modeling, window programming skill (C#, MFC,etc. ) - 전력반도체..."
https://kr.indeed.com/viewjob?jk=c3e5096601b8cad3,연계형 학사 신입 인턴십 수시,실리콘웍스 대전 유성구,,"압축 알고리즘 개발 - 정량/정성 화질 분석 및 평가 - Implementation:C, Matlab, python Modeling, window programming skill (C#, MFC,etc. ) - 개발/양산..."
https://kr.indeed.com/viewjob?jk=15edcadd124ad99a,매칭 데이터분석,Nexon 성남 분당구,,"최적화 된 모델을 적용하고 평가합니다. 지원자격 [이런 경험을 가진 파티원을 찾습니다.] - SQL, Python 등의 언어를 통해 데이터를 가공한 경험이 있는 분을 찾습니다. - 문제에 적합한 머신러닝 모델을 선택하고..."
https://kr.indeed.com/viewjob?jk=04d685fc70b67d4e,Linux/Python/PHP/MySQL/백엔드 정규직 경력,일루미나리안 용인 보정동,,"보유 - DBMS(MySQL or MariaDB), scripting Language: bash, python, OOP 언어 중 가능자 - Back-End 서버를 개발해 보신 분 [우대사항] - Go(aka GoLang..."
https://kr.indeed.com/viewjob?jk=71c47ac87bb4087e,기술 인턴 인공지능 응용 연구/개발 인턴,써로마인드로보틱스 서울 관악구,,"6개월) (협의) *모집 절차: 서류 à인터뷰(오프라인) *지원 자격: 프로그래밍 언어 활용 능력: Python, C, C++ 중 1가지 이상 데이터구조, 알고리즘 과목 이수 머신러닝과 딥러닝의 기본 개념 이해 머신러닝..."
https://kr.indeed.com/viewjob?jk=d13fce11058e6cf1,보안 모니터링 시스템 개발 및 운영 담당자 모집,카카오 4.0 성남 판교역,,"이터 분석을 위한 SIEM/ETL 플랫폼 개발/운영 지원자격 기본사항 경력 3년 이상 Java, Python 등의 언어로 개발 가능자 기본적인 웹 개발 및 Back-End 개발 가능자 DBMS 혹은 빅데이터(NoSQL..."
https://kr.indeed.com/viewjob?jk=6ede042ebe53ba49,RTL 기반 HW IP 설계 엔지니어 (딥러닝 하드웨어 프로세서 개발),딥엑스 성남 분당구,"연봉 40,000,000원 - 100,000,000원","모델의 RTL IP 설계 및 IP 검증 가능자 - Language: Python/Perl, C/C++ [우대 조건] - ARM based SoC 설계... 검증 가능자 - Language: Python/Perl, C/C++ [우대..."
https://kr.indeed.com/viewjob?jk=f9443d7fb97f2c5c,(주)한솔리드텍 기업부설연구소 경력직,한솔리드텍 경기도 의왕,,및 제출서류에 허위사실이 있을 경우 채용이 취소될 수 있습니다. 인터넷·IT·통신·모바일·게임>응용프로그래머> Python|인터넷·IT·통신·모바일·게임>응용프로그래머>C·C++|인터넷·IT·통신·모바일·게임>응용프로그래머...
https://kr.indeed.com/viewjob?jk=2b9e604e63e7e46d,[카카오커머스] 기술직군,카카오커머스 성남 분당구,,"우대사항 - 전자금융 감독규정, PCIDSS에 대한 실무 경험이나 이해도가 높으신 분 - JAVA, Python, shell script 등 개발 역량을 갖추신 분 - 웹/앱 취약점 진단 및 모의해킹 역량을 갖추신..."
https://kr.indeed.com/viewjob?jk=7af64be2575caa06,넷크루즈 전 부문 경력직,넷크루즈 서울 구로구,,능숙자 나. Go 능숙자 다. Python 능숙자 라. 분산 처리 능숙자... 응용프로그래머>JAVA|인터넷·IT·통신·모바일·게임>응용프로그래머> Python|인터넷·IT·통신·모바일·게임>빅데이터·AI(인공지능)> Python
https://kr.indeed.com/viewjob?jk=5200e54b6e9c0efd,"Product Applications Specialist, 3D visu...",Thermo Fisher Scientific 3.5 경기도 용인,,"machine and deep learning. - Programming experience is a plus ( Python scripting, C++, Matlab... Excellent communication..."
https://kr.indeed.com/viewjob?jk=1b62babbbf2d717a,경험최적화 - 데이터 사이언티스트/분석가,Nexon 성남 분당구,,피처 탐색 등) - 게임 내 행동 패턴 로그 분석과 패턴 식별 및 이를 통한 서비스 개선 지원자격 - Python을 사용한 데이터 분석 및 모델 개발 경험 - 머신러닝 라이브러리 활용 경험 - 셀프 모티베이션과 원활한...
https://kr.indeed.com/viewjob?jk=e0e37aaebc73dde3,지표구축,아프리카TV 경기도 성남,,"대시보드 플랫폼의 활용이 가능하신분 - 새로운 서비스 출시후 모니터링이나 트랜드 확인이 가능하도록 설계나 지원이 가능하신분 - SQL,Excel,R, Python 등을 이용하여 데이터 추출 또는 분석이 가능하신 분"
https://kr.indeed.com/viewjob?jk=3a30d4c7e59435c7,제주 국제학교 영어교육도시 위치 컴퓨터 전문 교육기관,스마트에듀학원 서귀포 서귀포시,,"2년수료증 제출가능자- 컴퓨터 전공, 디자인전공자 우대- 엔트리, 스크래치 블럭코딩, PPT 강사 1명- Python, Java, C언어와 같은 프로그램 강사 1명- 포토샵, 일러스트, 프리미어 강사 1명- 디지털아트, 라인..."
https://kr.indeed.com/viewjob?jk=435ab3980bfe52fe,빅데이터 엔지니어,케이뱅크은행 서울 중구,,통신·모바일·게임>빅데이터·AI(인공지능)>머신러닝|인터넷·IT·통신·모바일·게임>빅데이터·AI(인공지능)> Python|인터넷·IT·통신·모바일·게임>전산·IT기술지원>IT기술지원|인터넷·IT·통신·모바일·게임>응용프로그래머...
https://kr.indeed.com/viewjob?jk=1a75ce748c5f24e9,TOAST CAM 임베디드 개발,NHN 4.4 성남 판교역,,"또는 석사 학위 또는 그에 준하는 실무 경험자 (신입 지원가능) - 임베디드 환경에서 영상 처리 경험자 - Python, C++ 개발 경험 - 딥러닝 프레임워크, 컴퓨터 비젼 경험자 - Visual Object..."
https://kr.indeed.com/viewjob?jk=0b05f7fff851371a,게임 런처 개발,Nexon 성남 분당구,,르고 안정적으로 게임을 실행할 수 있도록 함께 고민하고 개발하실 분을 찾습니다. 지원자격 - C++ 혹은 Python 프로그래밍 언어 능숙자 - 비동기 및 병렬처리 프로그래밍 경험 우대사항 - Modern C++ (11...
https://kr.indeed.com/viewjob?jk=d0ca27a97ddf91f9,엔미디어플랫폼 데이터베이스 관리자 (DBA) 인재 안내,리더스소프트 성남 분당구,,"운영 가능한 분 - DB관련 자격증 보유한 분 - 운영 자동화 스크립트(PowerShell, Shell, Python) 작성 가능한 분 - MongoDB, Redis에 관심 있으신 분 기타사항 - 서류 접수 이후 4주 이내로..."
https://kr.indeed.com/viewjob?jk=68ebd25161b59749,소프트웨어 프로그램 개발자,그림 경기도 광명,"연봉 33,000,000원 - 50,000,000원","직무내용] Python:Deep learning S/W 개발Visual... level imageprocessing)Jave;Ul program, python / C++검사프로그램과 통신공학계열, 해당 직무 경험, 정보처리기사..."
https://kr.indeed.com/viewjob?jk=ae185a03d7b8f71e,"사물인터넷(IoT) 개발, 메카트로닉스 외 신입/경력 정규직",리쉐니에 수원 영통구,,"연구 빅데이터분석 및 AI개발 Python , WebRTC 프로그램개발... AI개발, Python / WebRTC프로그램개발 [우대사항] 전공계열: 공학계열 자격증: Python, Python 교육이수자, 빅데이터, 스마트공..."
https://kr.indeed.com/viewjob?jk=87309d3ff40ead61,딥러닝 AI 개발 연구원,베이리스 성남 수정구,,시스템프로그래머>임베디드(Embedded)|인터넷·IT·통신·모바일·게임>응용프로그래머>C·C++|인터넷·IT·통신·모바일·게임>응용프로그래머>Linux|인터넷·IT·통신·모바일·게임>빅데이터·AI(인공지능)> Python
https://kr.indeed.com/viewjob?jk=4d62f108017056a2,백엔드개발 인공지능바이오제약코스닥기업,대한민국,,"선과 신규 서비스의 UI, 기능을 설계 및 개발"" ※ 자격조건 - python 개발 경험(기본) - non-sql DB, sql DB 중 1개 이상... 사용 경험 - 풀스택 개발자 - python, C# 동시 사용"" 기타정보..."
https://kr.indeed.com/viewjob?jk=a0dda478567db352,"(주)트윔 개발자(경력직) 빅데이터,영상처리,머신비전/AI 딥러닝",트윔 경기도 화성,,"자기주도적으로 진행한 경험 - Python/C/C++ 능통자 - 데이터... RNN 등 딥러닝 이론 및 알고리즘 유경험자 - C/C++, Java, Python/TensorFlow/Caffe 사용가능자 - Matlab/R 분석..."
https://kr.indeed.com/viewjob?jk=ad07d6a330fb619a,NHN Cloud 운영 및 기술지원,NHN 4.4 성남 판교역,,"Linux, Microsoft Solutions 등) - 2년 이상의 개발 경험 (Java, Python 등) - 기술 문서 작성 및 가이드 경험이 풍부한 자 - 대외 고객 기술 지원 경험 - Windows..."
https://kr.indeed.com/viewjob?jk=6ac83986c1779aee,프로그래머 (어플리케이션 개발자 또는 웹개발자),오너클랜 서울 금천구,,인터넷·IT·통신·모바일·게임>응용프로그래머>자바스크립트|인터넷·IT·통신·모바일·게임>응용프로그래머> Python|인터넷·IT·통신·모바일·게임>응용프로그래머>C#|인터넷·IT·통신·모바일·게임>웹프로그래머>웹개발|인터넷...
https://kr.indeed.com/viewjob?jk=d917ed88ea21fd17,[ 아이콘트롤스 ] 2020년 경력 직원 (기술연구소) 연구개발부문,HDC아이콘트롤스 성남 분당구,,게임>응용프로그래머> Python|인터넷·IT·통신·모바일·게임>응용프로그래머>Android|인터넷·IT·통신·모바일·게임>응용프로그래머>iOS|인터넷·IT·통신·모바일·게임>웹프로그래머> Python|인터넷·IT·통신·모바일...
https://kr.indeed.com/viewjob?jk=9adbc290202846e1,[아이브릭스] 기업부설연구소 전문연구요원,아이브릭스 성남 분당구,,모바일·게임>응용프로그래머>JAVA|인터넷·IT·통신·모바일·게임>응용프로그래머>자바스크립트|인터넷·IT·통신·모바일·게임>빅데이터·AI(인공지능)>머신러닝|인터넷·IT·통신·모바일·게임>빅데이터·AI(인공지능)> Python
https://kr.indeed.com/viewjob?jk=6ef3ca96b9c753cd,에프앤가이드 전문연구요원,에프앤가이드 대한민국,,"지보수 관리 -. 자격요건 : ㆍ학력 : 이공계열 석사학위 이상 취득(예정)자 -. 우대사항 : ㆍ SQL, python, R 개발경험 소유자 근무조건 - 근무형태 : 정규직 - 모집구분 : 신입(사원급) - 근무시간..."
https://kr.indeed.com/viewjob?jk=f94ac3f1ca1d9088,인공지능개발자 및 웹 개발,애니로직 서울 금천구,,"직무내용] 인공지능을 개발 할 수 있는 인재를 구인합니다. Python으로 개발합니다.웹은 Java, javascript를 사용합니다.주 40시간가산디지털 단지내 [근무시간 및 형태] 주 5일 근무 (오전) 9시 00분~(오후..."
https://kr.indeed.com/viewjob?jk=3f8e87e291ecd55a,"화공 신입 정규직, 인턴",에이피에스티 서울 강서구,"연봉 30,000,000원 - 35,000,000원",Python 등 프로그램에 관심자 우대 안녕하세요. ㈜에이피에스티 대표 이덕형입니다.에이피에스티는 생산공장의 안전과 효율을 극대화하는 솔루션을 공급하고 있는 회사로 경쟁력 향상을 위해 자체 솔루션도 정부의 지원과 함께 개발하...
https://kr.indeed.com/viewjob?jk=14ed8097b3b4d463,[TGD] Data Scientist 모집,엔씨소프트 2.7 성남 판교역,,"지원자격 학력 : 무관 경력기간 : 3년 ~ 10년 필수조건 DB 성능까지 고려한 SQL 프로그래밍 가능자 Python을 이용한 데이터 분석 3년 이상 경력자 (SAS, SPSS 등 통계툴만 사용 가능한 경우 제외) 대용량..."
https://kr.indeed.com/viewjob?jk=41a3c612bb095e66,"경력직원 수시 (IT본부, 대체투자본부)",KIS채권평가 대한민국,,"개발 및 운영 -Django( Python)으로 개발된 시스템 운영 *필요... 서버의 관리 경험 - CD/CI에 대한 구성/관리 경험 - VBA, Python 개발 경험 (2) 모집부서: <대체투자본부> *포지션: 경력 *담당..."
https://kr.indeed.com/viewjob?jk=1e974ff27c6eb340,Autonomous Driving 분야 엔지니어,포티투닷 서울 강남구,,"프로그래밍 기술 (C/C++, Python 등) - 이동 로봇/드론 관련... platform 개발 경험 - 뛰어난 프로그래밍 기술 (C/C++, Python) - 3D geometry, math, physics 관련 경험 및..."
https://kr.indeed.com/viewjob?jk=87ab18830426d480,"드론솔루션 (아두이노 등 임베디드SW, 드론 ICT, 3D)",탱고드론 성남 분당구,"연봉 25,000,000원 - 30,000,000원","학력사항: 학력무관직무기술: 드론솔루션, 아두이노 등 임베디드SW, Python, 택배드론, 국방드론 무기체계, 드론HW제작, 원격수질측정드론, 화재... 통신·모바일·게임>응용프로그래머> Python|인터넷·IT·통신·모바일·게임..."
https://kr.indeed.com/viewjob?jk=dda4f419ad70cb8a,솔루션 개발 경력사원 채용,한화그룹 4.2 서울,,"Python 및 기타 프로그래밍 언어 능숙자(C/C++/C#/Java/PHP) 윈도우 및 리눅스 운영체제 활용 능숙자 IP 네트워크, 운영체제, 데이터베이스 등 CS 기본 지식 서버사이드스크립트( Python/PHP..."
https://kr.indeed.com/viewjob?jk=fc037709d0770796,System SW 엔지니어,딥엑스 성남 분당구,"연봉 40,000,000원 - 100,000,000원",사항: 대학교(4년)졸업 이상 [기본 요구능력] - ASM/C/C++/ Python 언어 코딩 기술 - 운영체제 SW 설계 및 구현 - 알고리즘/네트워... 게임>빅데이터·AI(인공지능)> Python|인터넷·IT·통신·모바일·게임...
https://kr.indeed.com/viewjob?jk=99caa544c92c8018,에프앤가이드 - 각 부문 (전문연구요원 포함),에프앤가이드 대한민국,,"우대사항 : ㆍ SQL, python, R 개발경험 소유자 디지털금융팀... 경험 ㆍ개인자산관리(PB) 경험 ㆍB2C 컨텐츠 기획 및 개발 경험 Python, R, Tensorflow, Keras 개발 가능 ㆍ머신러닝/딥러닝..."
https://kr.indeed.com/viewjob?jk=36c48cb9bc2758cb,매칭 기획,Nexon 성남 분당구,,"경험이 있다면 더 좋습니다. - 확률 및 통계에 대한 기본적인 지식이 있다면 더 좋습니다. - SQL, Python 등을 사용해 기초적인 데이터 분석, 머신러닝 등을 다루는 데에 관심이 있으면 더 좋습니다. - FIFA..."
https://kr.indeed.com/viewjob?jk=e97e5ff34697d5a9,[KRAFTON] 음성 (TTS/STT) 딥러닝 엔지니어,PUBG 서울,,험을 보유하신 분 독창적인 기술 제시 및 문제 해결을 위한 프로그래밍 능력을 보유하신 분 (C/C++/ Python/shell 등) 오픈소스 기반 딥 러닝 프레임워크 활용 능력을 보유하신 분 (PyTorch/TensorFlow...
https://kr.indeed.com/viewjob?jk=1d15e5adc115c979,서비스 개발 및 운영 관리,아이엠비디엑스 서울 금천구,,"jquery, apache http server, mariadb, python, django주요업무서비스 개발 및 인프라 운영 관리백엔드 - 서버... 업무 및 개발 경험자 Python, django, Java 및..."
https://kr.indeed.com/viewjob?jk=d69b5a1e60c65ce6,데이터 마케팅 경력사원,LG전자 3.8 서울 영등포구,,"능력 보유자 (SQL, R, Python, Scalar, Hadoop 등... 운영 경험자 - CRM 캠페인 기획/운영 경험자 - SQL, R, Python 등 통계 패키지 활용 자격증 보유자 모집기한: ~ 본 포지션 채용 시점..."
https://kr.indeed.com/viewjob?jk=e85e6f29a6b0e5f2,"SW개발, 시스템유지보수 외 신입/경력 정규직",다올플러스 대구,"연봉 25,000,000원 - 30,000,000원",그래머>JSP|인터넷·IT·통신·모바일·게임>웹프로그래머>JAVA|인터넷·IT·통신·모바일·게임>웹프로그래머> Python|인터넷·IT·통신·모바일·게임>웹프로그래머>HTML·DHTML·mHTML|인터넷·IT·통신·모바일·게임...
https://kr.indeed.com/viewjob?jk=489f19028e8a723b,통합인터페이스 백엔드 서버 개발,Nexon 성남 분당구,,"게임 빅데이터 실시간 처리 시스템 개발 지원자격 - 백엔드 서버 개발 경력 3년 이상 - Java, Python, Javascript 중 1개 이상의 프로그래밍 경험 - HTTP API 설계 및 개발 경험 - MSA..."
https://kr.indeed.com/viewjob?jk=8af2e47298c6f85b,SAP HANA Quality Specialist,SAP 4.3 서울,,"discipline Preferred skills Knowledge of LINUX Knowledge of Python/shell-Scripting, C/C++ Using C++-Debuggers (like GDB..."
https://kr.indeed.com/viewjob?jk=a3d6d5c1fad3ef7a,"Professional Services, Junior Consultant",Dell Technologies 4.0 서울,,transactions Experiences in Hadoop/MPP parallel database Python/Perl scripting experiences Here’s our story; now tell us...
https://kr.indeed.com/viewjob?jk=b3a6c83c9debcb92,네이버 파이낸셜 플랫폼 운영,NIT Service 성남 삼평동,,"Docker(kubernetes) 및 어플리케이션 배포 전략 지식 보유 - Shell script, python 및 web framework 등 기타 프로그래밍 언어 활용 가능 - 국가보훈대상자 및 장애인은 법령에 의거..."
https://kr.indeed.com/viewjob?jk=ce7849f8b35e1c3e,Technical Enablement Manager,DataDog 서울,,"Kubernetes or Rancher etc.. Scripting languages like Python, Javascript, Ruby, Perl, Go, PHP, or Chef/Puppet etc.. Why You..."
https://kr.indeed.com/viewjob?jk=665c109491ded05f,[웹젠] 프로그래밍(경력),웹젠 성남 분당구,,"사용자 - 유연한 사고와 원활한 의사소통 능력 보유자 ﻿ 우대사항 - Python, freebsd, MySql 경험자 - STL, Socket... 소통 능력 보유자 ﻿ 우대사항 - Python, freebsd, MySql..."
https://kr.indeed.com/viewjob?jk=a64e1e21f61265ce,각 분야별 인재 Pool 등록,지투알 서울,,"자 - 데이터 분석 툴(Adobe Analytics 또는 Google Analytics) 유경험자 우대 - Python, R, SQL 역량 보유자 우대 - 데이터에 기반한 문제해결 능력 및 통계학적 지식 보유자 우대 - 담당..."
https://kr.indeed.com/viewjob?jk=750c98eeab414ede,Senior DBA – BI (Korea),FPT Software 대한민국,,"CSV Experience with other technologies... Java, Python, .NET, Node.js, and Oracle APEX. Skill requirement: Ability..."
https://kr.indeed.com/viewjob?jk=cc44a37c1d6e7407,경력직 채용_Quant 리서치팀,한화그룹 4.2 서울,,선호하나 타 전공자도 지원 可) 2. 경력사항: 사원~대리급 - Database활용 및 운영 능력 - Python 패키지 개발 가능자 - 웹기반 시스템 개발 및 운용 능력 - Postgresql 경험자(우대) - Strong...
https://kr.indeed.com/viewjob?jk=e8a4630bec0783e8,2021 Market Data Analyst - Seoul,Bloomberg 서울,,"work experience using one more programming language... Python, SQL and R Fluency in Korean and English (both spoken..."
https://kr.indeed.com/viewjob?jk=f167a69d1680b2ed,"[펜타시큐리티] 보안S/W 개발 및 기획자 (웹, 인증, 블록체인)",펜타시큐리티시스템 서울 영등포구,,인터넷·IT·통신·모바일·게임>웹프로그래머>JAVA|인터넷·IT·통신·모바일·게임>웹프로그래머> Python|인터넷·IT·통신·모바일·게임>응용프로그래머>C·C++|인터넷·IT·통신·모바일·게임>응용프로그래머>JAVA|인터넷...
https://kr.indeed.com/viewjob?jk=1bd431b365bb2f77,데이터 분석 전문가,토이스미스 서울 강남구,"연봉 30,000,000원 - 40,000,000원","개발2. 분석 플랫폼 구축 프로젝트에 참여- 데이터의 수집 기획, 테스트, 실행, 개선[자격요건]- R과 Python 사용 능력- 통계, 데이터 마이닝, 데이터 모델링에 대한 이해 및 경험- MySQL, NoSQL 등 데이터..."
https://kr.indeed.com/viewjob?jk=2ba9d984a21e03b1,[전문연구요원] R&D 부문 개발자 병역특례,스칼라웍스 서울 금천구,,"Data Analysis (R, SQL 등의 활용 능력 우대)3) Python Application 관련 개발 업무 (코딩 또는 문제해결) 4) ML... 게임>빅데이터·AI(인공지능)> Python|인터넷·IT·통신·모바일·게임..."
https://kr.indeed.com/viewjob?jk=d736ed8b3142b924,Software Engineer - Embedded,GE Appliances 경기도 성남,,"C (must have) and C++(optional), lua(optional), python(optional) and Object Oriented Programming. Deep knowledge..."
https://kr.indeed.com/viewjob?jk=e27c921dfbf357ac,네이버 클라우드 플랫폼 기술지원,NIT Service 성남 삼평동,,"클라우드 서비스 운영 경험 (AWS, Azure, KT Cloud 등) - Shell Script, Python 활용 가능 - 국가보훈대상자 및 장애인은 법령에 의거 우대 (※입사지원 시 보훈/장애사항 체크 필수..."
https://kr.indeed.com/viewjob?jk=1d89fe4b37ab05ed,"데이터마이닝, 빅데이터 큐레이터 외 신입/경력 정규직",에임즈인터내셔널코리아 서울 강남구,,"있거나 이에 준하는 실질적인 기술 경력 -데이터를 다루기 위한 Python 혹은 R 등의 프로그래밍 능력 -SQL의 사용 능력 -데이터를 다루기 위한 Python, R, Java 중 1개의 프로그래밍 능력 -대용량 데이터..."
