ID,Title,Location,Salary,Summary
https://kr.indeed.com/viewjob?jk=31c8ae4a133b5147,SW(모바일앱 및 웹개발) 신입/경력 정규직 개발자,더조인 서울 강남구,,통신·모바일·게임>응용프로그래머>Android|인터넷·IT·통신·모바일·게임>응용프로그래머>iOS|인터넷·IT·통신·모바일·게임>응용프로그래머>인공지능(AI)|인터넷·IT·통신·모바일·게임>응용프로그래머> Python
https://kr.indeed.com/viewjob?jk=9c15d2c0cd7b70d8,프론트엔드개발 인공지능바이오제약코스닥기업,서울특별시,,"개선과 신규 서비스의 UI, 기능을 설계 및 개발 ※ 지원자격 - python 개발 경험(기본) - non-sql DB, sql DB 중 1개 이상... 사용 경험 - 풀스택 개발자 - python, C# 동시 사용 ※ 지원방..."
https://kr.indeed.com/viewjob?jk=752a4b5d63eac97c,Back-end Engineer (Python),Soomgo 서울 강남구,,숨고의 백엔드 엔지니어( Python)는 숨고의 기반 기술을 담당하는 매우... 5년 이상의 웹/앱 서비스 백엔드 시스템 개발 경험이 있는 분 • Python 언어를 활용한 개발 경험이 있는 분 • 성능 최적화에 대해 지속적으로...
https://kr.indeed.com/viewjob?jk=a98f8ea36438d276,S/W 서버엔진개발자 (python or java),하몬소프트 서울 금천구,"연봉 45,000,000원","모집분야 - 개발자( Python, Java) 담당업무 - 자사 서버 엔진 업무 진행 - 기본 수집/분석엔진 개발 - 빅데이터 분석 및 플랫폼 기반 엔진 개발 지원 필수 자격(신입기준) - Python 또는 Java 프로그..."
https://kr.indeed.com/viewjob?jk=1961a1ecccb03336,[NIT Service] 네이버 파이낸셜 플랫폼 운영,엔아이티서비스 성남 분당구,,"및 어플리케이션 배포 전략 지식 보유 - Shell script, python 및 web framework 등 기타 프로그래밍 언어 활용 가능... 보유 - Shell script, python 및 web framework..."
https://kr.indeed.com/viewjob?jk=2745b1d9f08b95d6,[진행중] 우리은행 MyDataACT 전문직(데이터 사이언티스트(데이터...,우리은행 4.5 서울 회현동,,"이터 분석 업무 경력 5년 이상 보유자(관련 서비스 기획, 운영 경력 합산) - 데이터 분석 관련 언어( Python, R 등) 사용 능력 및 분석 결과의 실제 서비스 적용 경험 보유자 - 적극적이고 원만한 커뮤니케이션..."
https://kr.indeed.com/viewjob?jk=11a178581008473e,주식운용본부 경력직원,디비자산운용 대한민국,,"분석 업무 경험 - 적극적 업무 추진 및 팀워크 능력 - 투자자산운용사, CFA 등 금융관련 자격 소지자 - Python, R 등 데이터 활용 능력 4. 전 형 : 1차- 서류전형 2차- 면접 3차- 면접 5. 서류접수기..."
https://kr.indeed.com/viewjob?jk=e1707e1b47680b5e,[ 히든그레이스] 빅데이터 & 연구 논문 분석가,히든그레이스 서울 서초동,,"mplus 활용 경험 R과 python 활용 경험 [정보기술>정보기술전략... 활용) ,프레젠테이션 프로그램 활용,기타(SPSS, Amos, R, python 활용 경험) 우대조건 - 고용허가제 - 작업환경 작업장소 : 실내..."
https://kr.indeed.com/viewjob?jk=fb3c542f0048b0f9,Software Engineer,Roku 서울,,"languages: C/C++, Python Knowledge... 분 적어도하나 이상의 컴퓨터 언어에 대한 경험이 있는 분(C/C++, Python) 네트웍과멀티스레딩 프로그래밍에 지식이 있으신 분 Data..."
https://kr.indeed.com/viewjob?jk=d80ca42562e966a4,경험최적화 - 머신러닝 엔지니어,Nexon 성남 분당구,,거나 더 나은 접근 방법 제안 - 머신러닝 파이프라인 설계 및 구축과 솔루션 프로토타이핑 지원자격 - Python에 숙련된 프로그래밍 능력과 머신러닝 라이브러리 활용 경험 - 머신러닝과 강화학습에 관련된 지식 습득 혹은...
https://kr.indeed.com/viewjob?jk=6d0095647ec5d2a4,광고데이터플랫폼 개발자 모집,카카오 4.0 성남 판교역,,"무와 데이터 파이프라인 시스템 설계/구축/관리 업무를 수행하게 됩니다. 지원자격 개발 경력 3년 이상 Python, Java, Kotlin, Scala 중 하나 이상의 언어에 능통 SQL 또는 HiveQL에 능통 대용량..."
https://kr.indeed.com/viewjob?jk=e010f7780d479126,검색서비스 서버 개발 신입/경력,포티투마루 서울 관악구,,"성별 : 무관 - 모집인원 : 0명 [기술 지원자격] - Linux 환경 개발 경력 - C/Java/ Python 개발 경력 - 서버 개발/운영 경력 [우대사항] - 자연어처리, 정보검색, 기계학습, 데이터 마이닝..."
https://kr.indeed.com/viewjob?jk=9dad04b0ae0c86d7,시스템 엔지니어,아프리카TV 경기도 성남,,"도입 및 개발/운영 [자격요건] - 리눅스/윈도우에 대한 이해도가 높고 지금도 노력중이신 분 - python 포함 프로그래밍을 즐거워 하시는 분 [우대사항] - docker, Kuvernetes 인프라 구축/운영..."
https://kr.indeed.com/viewjob?jk=33caa1d9a2c68113,클라우드 데이터플랫폼 운영 엔지니어,NHN SOFT 4.4 성남 판교역,,"력자 -대외 고객 기술 지원 경험자 -클라우드 플랫폼 운영 경험자 -2년 이상의 개발 경험자(Java, Python 등) -Hadoop 에코시스템을 통한 데이터 수집, 처리 및 지표 분석 경험 본 채용은 상시 채용으..."
https://kr.indeed.com/viewjob?jk=7e3b1db299d58974,에프앤가이드 - 각 부문,에프앤가이드 대한민국,,"3 ~ 7년 ㆍ 개인 대상 비즈니스 경험 ㆍ개인자산관리(PB) 경험 ㆍB2C 컨텐츠 기획 및 개발 경험 Python, R, Tensorflow, Keras 개발 가능 ㆍ머신러닝/딥러닝 관련 프로젝트 수행 경험 ㆍ자연어 처리분..."
https://kr.indeed.com/viewjob?jk=02bcd7b6412d1db9,자율주행연구팀 연구사원 (신입/경력),소네트 대구 달성군,,"필수사항 - C / C++ / Python 언어 사용 가능자 • 우대사항... C++언어 사용 가능자 • 우대사항 - 운전 가능자 - JAVA / python 언어 사용 가능자 - 오픈소스 (OpenCV, ROS 등) 사용 경험..."
https://kr.indeed.com/viewjob?jk=6f88041c28b6c1ae,한글 Q&A 시스템 연구 개발 신입/경력사원,포티투마루 서울 관악구,,"중(9월예정) [지원자격] - 4년제 대학교 졸업 (전산관련학과 이수 또는 그에 상응하는 교육이수자) - Python, Java, C/C++ 등으로 개발 가능하신 분 - Unix/Linux 시스템에 대한 이해가 있으신 분..."
https://kr.indeed.com/viewjob?jk=2c4c5856662783e7,Data Analyst,IQVIA 서울,,learning / predictive modeling ) • 통계 프로그램 활용 능력 SAS / R / Python 중 최소 1가지 중급 이상의 활용능력 요구 • Communication Basic English...
https://kr.indeed.com/viewjob?jk=e2b3c8893b105e37,[EY한영] 감사본부 파생상품평가부서(DVC) 경력직 모집,EY 4.0 대한민국,,"우대사항 - 금융공학/수학/컴퓨터 관련 전공자 - 이자율 파생상품 평가관련 지식 보유자 - C++/C, Python, VBA, QuantLib 활용 개발 유경험자 * 전형절차 - 1차 서류 심사 - 2차 실무 면접..."
https://kr.indeed.com/viewjob?jk=3d678bf37ef6b4a4,게임 서버 프로그래밍,Nexon 성남 분당구,,"실시간성이 필요한 로직 및 ML 알고리즘을 실행 하는 서버 개발 지원자격 - 한 가지 이상의 개발 언어( Python, C++, C#, Go 등)에 숙련된 프로그래밍 능력 - RESTful API 및 TCP/UDP 서버..."
https://kr.indeed.com/viewjob?jk=2ad85b06dc1bc1a4,Software Quality Engineer,Electronic Arts 서울,,"process improvements Strong scripting experience with Python, Shell Scripts, Ruby, etc. Familiarity with mobile/online game..."
https://kr.indeed.com/viewjob?jk=6fe5311eacbea17a,데이터 인프라 담당자 모집,카카오 4.0 성남 판교역,,"어링 5년 이상 업무 경험 보유자 하둡 에코시스템 기반 대용량 데이터의 수집, 가공이 가능한 분 Java, python, go, bash 등 언어 중 하나 이상 활용 가능하신 분 #우대사항 데이터 분석가, 머신러닝 전문가..."
https://kr.indeed.com/viewjob?jk=29053eab8b976b66,데이터분석 담당자,더블유게임즈 서울 강남구,,"과를 유관 부서에 효과적으로 전달하기 위한 시각화 작업 자격 요건 - 통계 지식 및 관련 툴(SQL, R, Python 등)을 사용한 데이터 분석 능력 - 데이터를 기반으로 도출 된 결과를 문서화 할 수 있는 능력 - 데이터..."
https://kr.indeed.com/viewjob?jk=05aa5498d84c58e1,데이터 엔지니어(신입/경력),쏘카 제주도 제주,,"있는 분 • 데이터 분석팀 및 유관 부서와의 원활한 소통을 위한 기본적인 쿼리 작성 능력을 갖춘 분 • Python 또는 Java, Scala, C++, C# 등의 언어를 최소 1개 이상 능숙하게 사용할 수 있는 분 • 대용..."
https://kr.indeed.com/viewjob?jk=a25c504ff473f758,스팸 및 어뷰징 분석/대응 시스템 개발자 모집,카카오 4.0 성남 판교역,,"개발 콘텐츠 모니터링을 위한 웹 어플리케이션 개발 지원자격 [기본사항] java (kotlin), python, scala 중 하나 이상 익숙하신 분 입사 후 최초 6개월 동안 제주 근무 가능하신 분 (제주 근무 기간..."
https://kr.indeed.com/viewjob?jk=166aa0c72e94a266,Business Data Analyst,Soomgo 서울 강남구,,"즈니스에 적용하고 개선한 경험 (Google Optimize, Optimizely, 등) 우대사항 • Python 또는 R 을 사용하여 데이터 분석에 활용 가능 • 경영학, 통계학, 경제학, data analysis 등..."
https://kr.indeed.com/viewjob?jk=b970fab4900ee5ec,[포털서비스] AB테스트 설계/분석 데이터 엔지니어 및 서버 개발자 모집,카카오 4.0 성남 판교역,,니다. 실험 프로세스 구축 및 이를 위한 도구 개발 지원자격 최소자격 개발 경력 2년 이상 Python 사용에 어려움이 없으신 분 우대사항 하둡 에코시스템에서 대용량 데이터 처리 경험이 있으신 분 ( hadoop...
https://kr.indeed.com/viewjob?jk=2b09f13b5790dd69,2021년 한화시스템 방산부문 프로젝트/기간제 엔지니어 채용(상시),한화그룹 4.2 서울,,분야 경험자 [우대 요건] 무인기 GCS 개발 유경험자 SW시험/분석 도구 개발 유경험자 C/C++/C#/ Python/JAVA 프로그래밍 숙련자 0명 판교 한화인1:1문의하기 활용 지휘통제-SW 계약기간 : 입사 시...
https://kr.indeed.com/viewjob?jk=25725b3c0e607311,Junior Quant Trader,Byzantine Partners 서울,,background is a plus Programming capability is mandatory (i.e. Python) Understanding of machine learning algorithm is a plus...
https://kr.indeed.com/viewjob?jk=7af6301dc691d3ab,Data Scientist,Toss 서울 강남구,,"실무 경험 5년 이상 갖추신 분 - 실제 서비스 데이터를 이용한 분석모델 개발 경험이 있으신 분 - R, Python, Scala, SQL 등 데이터 분석의 업무를 수행할 수 있는 하나 이상의 개발 언어에 능숙하신 분 #..."
