ID,Title,Location,Salary,Summary
https://kr.indeed.com/viewjob?jk=be95b5718905880f,AI/빅데이터/클라우드 분야 (인재 Pool),LG유플러스 3.8 서울,,"의미한 인사이트 발굴 - R, Python, SQL 등 Statistics... 등)의 다양한 솔루션을 활용하여 서비스 개발 경험자 2) Java, Python 등 프로그래밍 개발 경험 보유자 3) Container 기반 서비스..."
https://kr.indeed.com/viewjob?jk=7167a9017f74cb92,프로그래머 신입/경력 정규직,스타플러스 서울 서초구,,용이 취소될 수 있습니다. 인터넷·IT·통신·모바일·게임>웹프로그래머> Python|인터넷·IT·통신·모바일·게임>웹프로그래머>웹개발|인터넷·IT·통신... 통신·모바일·게임>응용프로그래머> Python|인터넷·IT·통신·모바일·게임...
https://kr.indeed.com/viewjob?jk=84fd9f9deb6105b0,"웹개발, Python 외 신입/경력 계약직",쿠바로엠앤씨 서울 강서구,,"주식회사 쿠바로엠앤씨 웹개발, Python 외 신입/경력 계약직 채용 모집... 게임>웹프로그래머>웹개발|인터넷·IT·통신·모바일·게임>웹프로그래머> Python|인터넷·IT·통신·모바일·게임>웹프로그래머>백엔드|인터넷·IT·통신..."
https://kr.indeed.com/viewjob?jk=c610c1b88e90ddb8,네이버 클라우드 플랫폼 기술지원,엔아이티서비스 성남 분당구,,"사항]- 클라우드 서비스 운영 경험 (AWS, Azure, KT Cloud 등)- Shell Script, Python 활용 가능- 국가보훈대상자 및 장애인은 법령에 의거 우대 (※입사지원 시 보훈/장애사항 체크 필수)[고용..."
https://kr.indeed.com/viewjob?jk=a4b72e38fb50bde0,콘텐츠서비스개발- 데이터엔지니어,Nexon 성남 분당구,,"ecosystem 에 대한 이해 - Python, Scala 등의 프로그... 경험이나 운영 경험 - 소프트웨어 빌드 및 배포 자동화 경험 - Python 또는 NodeJS를 활용한 시스템 개발 경험 - 프론트엔드 및 웹..."
https://kr.indeed.com/viewjob?jk=269f9a96319ef19a,머신러닝 엔지니어 모집,카카오 4.0 성남 판교역,,"델의 성능 검증 및 지속 개선 대규모 로그 데이터 통계 분석을 통한 피쳐 추출 지원자격 #필수사항 Python, Java, C++ 등 언어 중 하나 이상 활용 가능하신 분 TensorFlow/Keras, PyTorch..."
https://kr.indeed.com/viewjob?jk=b2661d357cf26c8f,플랫폼쉴드 시스템 개발,Nexon 성남 분당구,,"IP, 평판 등의 정보) 지원자격 - 전체 개발 경력 3~5년 - Python, Go 개발경력 우대(팀 내부 주 개발 언어가 Go, Python) - 비동기, 병렬처리 프로그래밍 기술 - OS, DB, H/W, 네트워..."
https://kr.indeed.com/viewjob?jk=20d40ee61adffeca,챗봇 및 상담 플랫폼 서버 개발자 모집,카카오 4.0 성남 판교역,,"담시스템 코어 서버 개발 (kotlin/spring) QA 시스템 백엔드 서버 개발 (java/spring, python/flask) 챗봇 및 상담 통계 시스템 개발 (scala/spark) 위의 업무 중 하나에 참여하게..."
https://kr.indeed.com/viewjob?jk=a1d687cd59776360,머신러닝 개발,Nexon 성남 분당구,,모델 개발 - 머신러닝을 위한 솔루션 프로토타이핑 - 머신러닝 파이프라인 설계 및 구축 지원자격 - Python에 숙련된 프로그래밍 능력과 머신러닝 라이브러리 활용 경험 - 머신러닝과 강화학습에 관련된 지식 습득 혹은...
https://kr.indeed.com/viewjob?jk=7df915e1f0f86b2d,Software Architecture 설계 엔지니어,딥엑스 성남 분당구,"연봉 40,000,000원 - 100,000,000원",경험 - Windows/Linux 상에서 C++/ Python 언어 사용 개발 경험 - C++ / Python 언어 사용 개발 경험 - 객체지향 설계에... 게임>빅데이터·AI(인공지능)> Python|인터넷·IT·통신·모바일·게임...
https://kr.indeed.com/viewjob?jk=662beff5f293820b,AR/VR SDK 개발자 모집,카카오 4.0 성남 판교역,,"iOS 및 PC/Web 플랫폼향 API 개발 (C++, Java/Kotlin, ObjC/Swift, Python, Javascript) 멀티플랫폼 패키징 및 배포시스템 개발, 유지보수 모바일 최적화 및 플랫폼 이슈 대응..."
https://kr.indeed.com/viewjob?jk=5158175feb7b77e8,"경력사원 상시채용(웹/모바일 개발, 인프라/보안)",현대아이티엔이 서울 대치동,,"서버/네트워크 인프라 지식 및 기술 보유자 [우대사항] -웹/앱/인프라 모의해킹 경험자 -프로그램( Python,, C, JAVA) 보안 개발 및 시큐어 코딩 가능자 -End-point 보안 취약점 조치 가능자 -보안..."
https://kr.indeed.com/viewjob?jk=464ad076ec3e1fa0,CHC – Business intelligence - TOM_2136,Sanofi 4.1 서울,,"degree in related field Business-level experience with R, Python Experience owning the analytics and performance of a large..."
https://kr.indeed.com/viewjob?jk=6aebabcddef7f514,Field Application Engineer,Nearfield Instruments 경기도 용인,,"troubleshooting. Preferably to have coding capability (Matlab, Python...etc... data analysis, visualization, and algorithm..."
https://kr.indeed.com/viewjob?jk=84bf7be258ec679b,Software Developer - OSS and Network Man...,Ericsson 서울,,"Programming Language and skillset: Java(preferred), C++, Python, CI Environment, Shell Script Native Korean and business..."
https://kr.indeed.com/viewjob?jk=641ae0914b7eb183,농업정책보험금융원 신규직원,농업정책보험금융원 서울,,"제출 통계 패키지*를 활용하여 통계, 응용통계 및 데이터 분석 업무 경력이 1년 이상인 자 * SAS, R, python 등 * 경력증명서(담당업무 혹은 소속부서로 업무 추정이 가능할 경우 소속부서가 명시되어야 함) 제출..."
https://kr.indeed.com/viewjob?jk=89f3e10d77a126bf,Field Service Engineer,Nearfield Instruments 경기도 용인,,"troubleshooting. Preferably to have coding capability (Matlab, Python...etc... data analysis, visualization, and algorithm..."
https://kr.indeed.com/viewjob?jk=df21e3bb5d773616,Python Programmer,Mofac 서울 서초구,,개발 – JAVA 프로그래밍(라이브러리 활용) – Spring 프레임 워크 개발 – Python API 프로그래밍 우대사항 – Python 개발 경험 – Open Source 라이브러리 개발경험 – Web 표준에 대한 경험...
https://kr.indeed.com/viewjob?jk=27d7e0e6e1cd10f0,Application Engineer - HAV,Mentor Graphics (Korea) LLC 4.0 경기도 성남,,"C/C++ for IP verification Knowledge of scripting using Perl, Python, Makefile with UNIX... LINUX platforms Knowledge..."
https://kr.indeed.com/viewjob?jk=68a69dd27ac61230,(데이터개발) 데이터 엔지니어,Nexon 성남 분당구,,"끊임없이 흐르는 데이터를 모니터링하고 오류를 감지하는 시스템을 구축 지원자격 - Linux 환경에서 Python, Scala, Java, Go 중 한 가지 이상의 언어로 개발이 가능하신 분 - 자료구조, 알고리즘, 데이터..."
https://kr.indeed.com/viewjob?jk=a7a22c905ff6f1ea,"웹개발, ASP 외 신입/경력 정규직",엔잡얼라이언스 서울 금천구,,및 유지보수AI관련 개발 담당 Python 개발자(0명)- AI 솔루션... 게임>웹프로그래머> Python|인터넷·IT·통신·모바일·게임>웹디자인>웹디자인|인터넷·IT·통신·모바일·게임>빅데이터·AI(인공지능)> Python
https://kr.indeed.com/viewjob?jk=8b72b646bd1d09cd,[무료교육/월 150만원 지원] 실감형콘텐츠창작자 양성과정,메디치이앤에스 서울 금천구,,통신·모바일·게임>빅데이터·AI(인공지능)>데이터분석|인터넷·IT·통신·모바일·게임>빅데이터·AI(인공지능)> Python|인터넷·IT·통신·모바일·게임>빅데이터·AI(인공지능)>머신러닝|인터넷·IT·통신·모바일·게임>빅데이터...
https://kr.indeed.com/viewjob?jk=4e91309fc89e9534,2020년 하반기 영업/기획/마케팅/개발 부문,아우토크립트 서울 영등포구,,통신·모바일·게임>응용프로그래머> Python|인터넷·IT·통신·모바일·게임... 프로그래머> Python|인터넷·IT·통신·모바일·게임>웹프로그래머>JAVA|인터넷·IT·통신·모바일·게임>빅데이터·AI(인공지능)> Python|인터넷...
https://kr.indeed.com/viewjob?jk=4f15a728f10dc0b7,(주)엘솔루 R&D본부 ASR팀 개발직,㈜엘솔루 서울,,"제공 [필수사항] ㆍ프로그래밍에 재능 및 열정이 있는 자 ㆍJava, Python 중 하나 이상의 언어사용자 ㆍWeb 개발능력 ㆍ리눅스 사용 경험자... 머신러닝(ML)|인터넷·IT·통신·모바일·게임>응용프로그래머> Python"
https://kr.indeed.com/viewjob?jk=754be9e3d78fa802,2021년 상반기 R&D 개발자 (병역특례 가능/경력 무관),네오스텍 인천 연수구,,"담당업무: - 블루투스 메시 기반 위치 추적 솔루션 개발 - 상기 솔루션의 임베디드 펌웨어 개발 - C(필수), Python, Javascript 프로그래밍 언어 사용 - 기술 지원 [자격요건] 경력사항: 무관 (신입도 지원..."
https://kr.indeed.com/viewjob?jk=5774fe0069caa7c3,(주)엘솔루 웹 개발자,㈜엘솔루 서울,,Stack 개발 유경험자. Javascript / React / Python / NodeJS 개발 유경험자 Node.js 개발 유경험자 HTML 5... ㆍJavascript / React / Python / 인터넷·IT·통신...
https://kr.indeed.com/viewjob?jk=7d155eed9eceae77,[빅데이터 분석] 인턴,레드테이블 서울 종로구,"월급 2,000,000원","음식.관광 분야에 배경지식을 갖추신 분 Python, R, SQL, 통계프로그램... 서서류전형, 면접전형/ 우대사항음식.관광 분야에 배경지식을 갖추신 분 Python, R, SQL, 통계프로그램 등을 활용하여 데이터 정제, 분석, 모델..."
https://kr.indeed.com/viewjob?jk=6b87cf36ef9a9f9e,[신규 프로젝트] Back-End 프로그래머 모십니다.,엔씨소프트 2.7 성남 판교역,,"Framework(Spring Boot)또는 Node.js 이용한 Application 개발 경험자 2. Python, Javascript 등의 스크립트 활용 3. mongoDB, mysql 개발 경험자 4. 최신 기술 동향..."
https://kr.indeed.com/viewjob?jk=9e33ba5655e4cdac,(주)엘솔루 웹 프로그래머,㈜엘솔루 서울,,그래머>웹개발|인터넷·IT·통신·모바일·게임>웹프로그래머>JAVA|인터넷·IT·통신·모바일·게임>웹프로그래머> Python|경영·인사·총무·사무>경영·기획·전략>경영기획|경영·인사·총무·사무>경영·기획·전략>사업기획|경영·인사...
https://kr.indeed.com/viewjob?jk=c30199c246d18ea8,[정규직] 웹개발자 경력직,링크프라이스 서울 금천구,,"Crawling 개발 가능하신 분▶ Python 언어 사용 가능하신 분※개발환경 : Java, JSP, Spring, MyBatis, jQuery, DHTMLX, MSSQL, MariaDB, Python, C#.net 0 명..."
https://kr.indeed.com/viewjob?jk=b732fb33829bcacb,(대기업) 비파괴 검사/평가,인코리아 프로페셔널 창원 성산구,,"기술개발 또는 실무 - 프로그래밍 및 데이터분석 (Matlab, Python, C/C++/C# 중 1개 이상) 중급이상 [Optional] - 초음파... 통신·모바일·게임>응용프로그래머> Python|인터넷·IT·통신·모바일·게임..."
https://kr.indeed.com/viewjob?jk=b102b3d8f193a4c1,2021 GEDP (Global Engineering Developmen...,GE Appliances 경기도 성남,,using C programming language Scripting languages like Lua/ Python/JavaScript may also be used if needed Support connected...
https://kr.indeed.com/viewjob?jk=1ed0a0c73f723e79,신경망 연구 개발자,에스알유니버스 서울 마포구,"연봉 40,000,000원 - 50,000,000원","신입, 경력(연차무관)학력사항: 대학교(4년)졸업직무기술: 딥러닝, Python, TensorFlow, openCV[우대사항]전공계열: 공학계열... 게임>빅데이터·AI(인공지능)> Python|인터넷·IT·통신·모바일·게임..."
https://kr.indeed.com/viewjob?jk=41c5fc108900f60b,Data Scientist 경력인재 - 글로벌 우량대기업,에스에프인촌 서울,,모바일·게임>빅데이터·AI(인공지능)>데이터분석|인터넷·IT·통신·모바일·게임>빅데이터·AI(인공지능)> Python|인터넷·IT·통신·모바일·게임>빅데이터·AI(인공지능)>데이터시각화디자이너|인터넷·IT·통신·모바일·게임...
https://kr.indeed.com/viewjob?jk=55a19c92c845685e,Developer / Designer recruit,마이뮤직테이스트 서울 논현동,,"language (i.e Python, Ruby, Java, .Net... High proficiency in Python... knowledge... least one Python web framework..."
https://kr.indeed.com/viewjob?jk=8783f7aed2707754,프론트앤드 개발,Nexon 성남 분당구,,"UX에 대한 지속적인 관심 - 더 나은 코드를 위해 노력하시는 분 - Spring, Node.js, Python 등 한 가지 이상의 백엔드 기술에 대한 이해 - TypeScript 경험자 우대 - 프로젝트 설정부터..."
https://kr.indeed.com/viewjob?jk=c50980a13561ae0d,기술연구소 웹개발(JAVA/ASP/Python) 및 웹디자이너,엔잡얼라이언스 서울 금천구,"월급 2,000,000원","직무내용] Java 기반 웹개발, 모바일웹개발 및 유지보수 Python 및 AI 개발자, 딥러닝/머신러닝 활용, TensorFlow 활용웹디자인 웹퍼블리싱ASP, MS-SQL기반 웹프로그램 개발 [근무시간 및 형태] 주 5일..."
https://kr.indeed.com/viewjob?jk=b3bad30597277db5,금융 AI 기술 연구 개발자 모집,엔씨소프트 2.7 성남 판교역,,"및 연구/문제 해결 능력 - Python 언어에 능숙하신 분 2. 해당직... Recognition, Data/Text Mining 경험 보유 - Python, SQL 활용 우대사항 - AI 관련 전공자 - 금융 도메인에 대한..."
https://kr.indeed.com/viewjob?jk=b86da88c2546f564,"Software Engineer, University Graduate",Google 4.3 서울,,"languages, including... limited to: Java, C/C++, Python, JavaScript, or Go. Experience working with one or more from..."
https://kr.indeed.com/viewjob?jk=046c7e4a3e9228c1,루티너리데이터 분석가 전세계 50만 명의 일상 바꿉니다,루티너리 서울 서초구,,"BigQuery에서 SQL쿼리를 하기도 하고요. 정제한 데이터는 Python, R 등 익숙한 환경에서도 물론 분석할 수 있고, 데이터 파이프라인에... Redshift 등), Python(Pandas), R, Excel 등을..."
https://kr.indeed.com/viewjob?jk=649ccf047c868778,"금융 데이터 분석 엔진, 로보어드바이저 개발자",에스비씨엔 서울 영등포구,,"시스템, 머신러닝, 자연어처리. 패턴분석 - 다음 언어에서 최소 한 가지 이상 능숙자: Java, C++, Python, JavaScript 우대사항 - 석사이상 컴퓨터공학 (Computer Science) 분야 또는..."
https://kr.indeed.com/viewjob?jk=41bfd674f66c0c14,[KSTEC] RPA 시스템 개발 경력사원,지식시스템 성남 분당구,,통신·모바일·게임>웹프로그래머>JAVA|인터넷·IT·통신·모바일·게임>웹프로그래머>.NET|인터넷·IT·통신·모바일·게임>웹프로그래머> Python|인터넷·IT·통신·모바일·게임>웹프로그래머>HTML·DHTML·mHTML
https://kr.indeed.com/viewjob?jk=39ccd72cab530083,의료기기 기구설계 정규직,다인그룹 경기도 김포,,"험자• 이미지 가공 및 처리 경험자• 하드웨어 입력 처리 경험자• 경력: 3년~10년[우대사항]• Java, Python, C++, C# 최소한 한가지 이상의 주요 언어에 능통하신 분• PACS, DICOM, HL7 등 의료..."
https://kr.indeed.com/viewjob?jk=d83fc0dd2641f483,전문연구요원 (병역특례) 수시 (AI / SW 분야),딥엑스 성남 분당구,"연봉 40,000,000원 - 100,000,000원",요구 능력] - ASM/C/C++/ Python 언어 코딩 기술 - 운영체제... 경험 - Windows/Linux 상에서 C++/ Python 언어 사용 개발 경험 - C++ / Python 언어 사용 개발 경험 - 객체지향 설계에...
https://kr.indeed.com/viewjob?jk=090f509f2c688949,[신입/정규] 광고솔루션(python),니트머스 서울 명동,"연봉 28,000,000원","명동1가) (명동1가, 보림빌딩 11층) 인근지하철 직무내용 [담당업무] ㆍ온라인 광고 플랫폼 개발 ㆍ Python 기반 프론트엔드/백엔드 서비스 개발 ㆍPHP 기반 웹 서비스 개발 [우대사항] ㆍ정보처리기사 자격증..."
https://kr.indeed.com/viewjob?jk=b0a6480d9ba97da1,전 분야 R&D 개발자 (병역특례자),스칼라웍스 서울 금천구,"연봉 30,000,000원 - 32,000,000원","Development 관련 개발 2) Data Analysis 업무 (R, SQL 등의 활용) 3) Python Application 관련 개발 업무 4) 전산 이론 기초 (Data Structure, Algorithm) 5..."
https://kr.indeed.com/viewjob?jk=089931931a0474d5,소형전지사업부/기술혁신센터,삼성SDI 3.9 충청남도 천안,,"천안 전공분야 - 컴퓨터/시스템 전자/전기 기계/산공 전문지식 - Java, C#, C++, Python - Oracle (PL/SQL) - Automod, VisualComponent - 통신프로그래밍 경험..."
https://kr.indeed.com/viewjob?jk=98a0ea3726575729,글로벌주식운용팀 경력사원 안내 (~6/4),삼성자산운용 대한민국,,"량분석(Quantitative Analysis)을 통한 개별주식 운용 전략 개발 및 운용 경력(필수) - Python, VBA 등의 프로그래밍 언어를 통한 개발 능력 및 MS SQL 등의 데이터베이스 연계 프로그래밍 경력자..."
https://kr.indeed.com/viewjob?jk=886d3a9fee3da0bf,Diploma Student / Intern - HANA Cloud De...,SAP 4.3 서울,,"skills: Proficiency in Linux Coding skills in Scala, Java, Python or similar Understand docker containers and Kubernetes..."
https://kr.indeed.com/viewjob?jk=83f9ed690d907b50,(주)오픈시스넷 딥러닝 개발자 정규직,오픈시스넷 성남 분당구,,"직책: 대리, 팀원 [자격요건]경력사항: 경력(3년 이상 )학력사항: 대학교(4년)졸업 이상우대사항 : - Python 개발 가능자- 딥러닝 프레임워크 기반 지식 보유자- OpenCV, NumPy, SciPy 라이브러리 지식..."
https://kr.indeed.com/viewjob?jk=ab38178e6071aa0f,"Engr, Apps Dev 2",KLA-Tencor 대한민국,,"working effectively with different cultures. Matlab/ Python experience is a plus. We offer a competitive, family friendly..."
https://kr.indeed.com/viewjob?jk=94ba4ea99cd18f87,퀀트투자팀 직원(신입 또는 경력),에이치디씨자산운용 대한민국,,학력 소지자 - 해당 업무경력 2년 이상의 경력자 우대 - Passive 상품 관련 경험자 우대 - Python 등 프로그래밍 가능한 자 - 투자자산운용사 우대 - 영어 능통자 우대 2. 전형절차 1차 서류전형...
https://kr.indeed.com/viewjob?jk=1c2dec1a2156f6aa,(데이터개발) API플랫폼 개발자,Nexon 성남 분당구,,"architecture를 구현하고 이를 효과적으로 관리할 수 있는 기반 개발 지원자격 - Java, Go, Python 중 한 가지 이상의 언어를 이용한 웹 서비스 개발 경험이 있으신 분 - MySQL 등의 RDBMS..."
https://kr.indeed.com/viewjob?jk=4adac8923476d038,프랭클린템플턴투신운용 Junior Trader (Quant base 필수...,프랭클린템플턴투신 대한민국,,"object-oriented programming and intermediate programming proficiency in Python, R or MATLAB, and SQL are essential. Licenses..."
https://kr.indeed.com/viewjob?jk=06a6e700196764b9,[AI R&D] Language AI(NLP) Research 분야 수시...,엔씨소프트 2.7 성남 판교역,,"분 - 통계/Machine Learning에 대한 이해와 활용 능력 및 text 처리 기술에 대한 경험 - Python, Java 등을 이용하여 NLP 기술을 구현 가능한 분 - 최신 기술(논문, 기술문서 등)을 습득하는..."
https://kr.indeed.com/viewjob?jk=1a5921b26b0fd291,[진행중] 우리은행 AI사업부 전문직(인공지능(AI) 모델링 및 기획)...,우리은행 4.5 서울 회현동,,"알고리즘 설계/검증 및 성능 개선 업무 경력 보유 - 인공지능 포함 디지털 서비스 기획 경험자 - Python, R 등 프로그래밍 활용 역량 보유 - 은행, 카드, 보험 등 금융 분야 프로젝트 리더 경험자 우대..."
https://kr.indeed.com/viewjob?jk=4ec305f59ce64060,게임이상탐지 분석/개발,Nexon 성남 분당구,,"기법 적용에 필요한 프로그래밍 능력 ( Python) - SQL 활용 능력... 대시보드 개발 능력 솔루션 개발자 - 한 가지 이상의 개발 언어( Python, Java, Scala)에 숙련된 프로그래밍 능력 - Linux..."
https://kr.indeed.com/viewjob?jk=35ba221c73ad31a2,Data Engineer,Barbaricum 경기도 평택,,"data APIs, data modeling, and data warehousing solutions. R, Python, Ruby, C++, Perl, Java, SAS, SPSS, and Matlab. Strong..."
https://kr.indeed.com/viewjob?jk=dd4228e2f6d28c7d,IT 웹/응용/시스템프로그래머,이루텔럭키 경기도 군포,"연봉 27,000,000원 - 37,000,000원","직무내용] * Python flask를 이용한 서비스 개발 지원 및 서버프로그램 개발지원 신입사원 모집 솔루션 개발 및 유지보수 (사물인터넷, 웹, 머신러닝 플랫폼) [근무시간 및 형태] 주 5일 근무 (오전) 9시 00분..."
https://kr.indeed.com/viewjob?jk=8477c4d5b3c9af1b,(주)쎄미시스코 소프트웨어 및 머신러닝 개발자 신입/경력,쎄미시스코 수원 권선구,,"Data set 설계 최적화 및 안정화 기술 보유자 - 영상처리 기술 보유자 - 프로그래밍 능숙자 (C++, Python, Tensorflow, Mxnet 등) 전자·기계·기술·화학·연구개발>전자·반도체>반도체|전자·기계..."
https://kr.indeed.com/viewjob?jk=d8055c704bb31d85,Server Engineer (Engineering Foundation),뱅크샐러드 서울 영등포구,,"대한 지식 및 판단을 토대로 뱅크샐러드 적용 가능성 제시 자격 요건 Golang/Java(Kotlin)/ Python 중 하나 이상을 이용한 서비스 설계 및 개발 경험 보유 CS Fundamental (자료 구조, 운영체제..."
https://kr.indeed.com/viewjob?jk=9ab2041ab3380a21,카카오톡 안티어뷰징을 위한 데이터/백엔드 엔지니어 및 머신러닝 전문가 모...,카카오 4.0 성남 판교역,,"Engineer, Data Scientist 해당 분야에서 활용되는 언어 및 도구를 능숙하게 다룰 수 있는 분( Python, Scala, PyMC, PySpark, Tensorflow 등) 우대 사항 컨테이너 환경에서의..."
https://kr.indeed.com/viewjob?jk=3a1ca670038a509c,[국내 최고회사] Front-End 개발자,인코리아 프로페셔널 성남 분당구,,프론트엔드|인터넷·IT·통신·모바일·게임>웹프로그래머>웹개발|인터넷·IT·통신·모바일·게임>웹프로그래머> Python|인터넷·IT·통신·모바일·게임>웹기획·웹마케팅·PM>웹서비스기획|인터넷·IT·통신·모바일·게임>웹기획·웹마케...
https://kr.indeed.com/viewjob?jk=d17da0baecf05910,데이터 분야 경력,LG CNS 3.7 서울,,"해가 뛰어난 자 - R, Python, SAS, SQL 등 활용 역량 우대사항(해당 내용 중 1개 이상) - ML/DL 경험 인력 우대 - 관련 분야 석사 이상 학위 소지자 우대 - R, Python등 데이터분석 모델링 경험..."
https://kr.indeed.com/viewjob?jk=bca74f8f09d404ad,주식 투자 분야 PYTHON 백엔드 개발자,주)씽크풀 서울 영등포구,,통신·모바일·게임>빅데이터·AI(인공지능)>빅데이터|인터넷·IT·통신·모바일·게임>빅데이터·AI(인공지능)> Python|인터넷·IT·통신·모바일·게임>빅데이터·AI(인공지능)>머신러닝|인터넷·IT·통신·모바일·게임>데이터베이...
https://kr.indeed.com/viewjob?jk=7fdcd7a7457b1e93,데이터 분석,아프리카TV 경기도 성남,,"의 서비스 이용/소비형태/이상현상과 트렌드 변화가 궁금하신 분 - B2C서비스 데이터 분석 직군에서 데이터 핸들링 경험이 있으신 분 - SQL,Excel,R, Python 등을 이용하여 데이터 추출 또는 분석이 가능하신 분"
https://kr.indeed.com/viewjob?jk=531ce6c2d773380a,(주)엘솔루 음성인식팀 개발직,㈜엘솔루 서울,,인터넷·IT·통신·모바일·게임>응용프로그래머>머신러닝(ML)|인터넷·IT·통신·모바일·게임>응용프로그래머> Python|무역·영업·판매·매장관리>기술영업>SI(Solution·System)|무역·영업·판매·매장관리>기술영업...
https://kr.indeed.com/viewjob?jk=85cf43a0e2418138,웹 플랫폼 개발자,Nexon 성남 분당구,,"개발 및 운영 지원자격 - 경력에 준하는 웹 개발 기본 지식을 보유 하신 분 - 웹언어 (Java, Python, C#, PHP 등)을 이용한 Back-End 개발 경력이 3년 이상 또는 그에 준하는 능력을 보유하신 분..."
https://kr.indeed.com/viewjob?jk=c7d3e27d85495e80,Data Scientist,뱅크샐러드 서울 영등포구,,"기반 예측, 모델링 프로젝트 경험자 데이터 분석/모델링을 위한 언어 및 프레임워크 사용에 익숙하신 분 ( Python, R, SQL, Pandas, TensorFlow, Pytorch, Spark 등) 회사 내부 구성원들과..."
https://kr.indeed.com/viewjob?jk=57bdd7637eb78455,테크빌더팀 웹(프론트/백엔드)개발,Nexon 성남 분당구,,"Ubuntu) - React, Angular, jQuery - Python, Flask, Nginx, ElasticSearch, MySQL 지원... 발해 보신 분 * 백엔드 - Python, Java, C# 중 한 가지..."
https://kr.indeed.com/viewjob?jk=bfaeba8c0f81b11c,Threat Hunter Team Lead,Ensign InfoSecurity 대한민국,,"programming and scripting, e.g. Java, .NET Programming, Python & PERL scripting, etc. Possession of excellent presentation..."
https://kr.indeed.com/viewjob?jk=aa13332a8009c705,Application Engineer Korea,IMS Nanofabrication 경기도 화성,,"You are committing to support the team in challenging situations. Python, Office solutions and Linux experience is beneficial..."
https://kr.indeed.com/viewjob?jk=54e0d08c99dcf507,MI(Market Intelligence)담당 마케팅 전략 경력사원,LG전자 3.8 서울 영등포구,,"AL이상 성적에 대하여 1개 이상 보유 4) 우대 사항 - 통계 분석 및 프로그래밍 언어 역량 보유: R, python, Java, SPSS, Tableau, etc. - 영어 능통 역량: 해외법인과 영어 화상 회의 및 현지..."
