ID,Title,Location,Salary,Summary
https://kr.indeed.com/viewjob?jk=c30199c246d18ea8,[정규직] 웹개발자 경력직,링크프라이스 서울 금천구,,"Crawling 개발 가능하신 분▶ Python 언어 사용 가능하신 분※개발환경 : Java, JSP, Spring, MyBatis, jQuery, DHTMLX, MSSQL, MariaDB, Python, C#.net 0 명..."
https://kr.indeed.com/viewjob?jk=55a19c92c845685e,Developer / Designer recruit,마이뮤직테이스트 서울 논현동,,"language (i.e Python, Ruby, Java, .Net... High proficiency in Python... knowledge... least one Python web framework..."
https://kr.indeed.com/viewjob?jk=090f509f2c688949,[신입/정규] 광고솔루션(python),니트머스 서울 명동,"연봉 28,000,000원","명동1가) (명동1가, 보림빌딩 11층) 인근지하철 직무내용 [담당업무] ㆍ온라인 광고 플랫폼 개발 ㆍ Python 기반 프론트엔드/백엔드 서비스 개발 ㆍPHP 기반 웹 서비스 개발 [우대사항] ㆍ정보처리기사 자격증..."
https://kr.indeed.com/viewjob?jk=5158175feb7b77e8,"경력사원 상시채용(웹/모바일 개발, 인프라/보안)",현대아이티엔이 서울 대치동,,"서버/네트워크 인프라 지식 및 기술 보유자 [우대사항] -웹/앱/인프라 모의해킹 경험자 -프로그램( Python,, C, JAVA) 보안 개발 및 시큐어 코딩 가능자 -End-point 보안 취약점 조치 가능자 -보안..."
https://kr.indeed.com/viewjob?jk=68a69dd27ac61230,(데이터개발) 데이터 엔지니어,Nexon 성남 분당구,,"끊임없이 흐르는 데이터를 모니터링하고 오류를 감지하는 시스템을 구축 지원자격 - Linux 환경에서 Python, Scala, Java, Go 중 한 가지 이상의 언어로 개발이 가능하신 분 - 자료구조, 알고리즘, 데이터..."
https://kr.indeed.com/viewjob?jk=c50980a13561ae0d,기술연구소 웹개발(JAVA/ASP/Python) 및 웹디자이너,엔잡얼라이언스 서울 금천구,"월급 2,000,000원","직무내용] Java 기반 웹개발, 모바일웹개발 및 유지보수 Python 및 AI 개발자, 딥러닝/머신러닝 활용, TensorFlow 활용웹디자인 웹퍼블리싱ASP, MS-SQL기반 웹프로그램 개발 [근무시간 및 형태] 주 5일..."
https://kr.indeed.com/viewjob?jk=27d7e0e6e1cd10f0,Application Engineer - HAV,Mentor Graphics (Korea) LLC 4.0 경기도 성남,,"C/C++ for IP verification Knowledge of scripting using Perl, Python, Makefile with UNIX... LINUX platforms Knowledge..."
https://kr.indeed.com/viewjob?jk=be95b5718905880f,AI/빅데이터/클라우드 분야 (인재 Pool),LG유플러스 3.8 서울,,"의미한 인사이트 발굴 - R, Python, SQL 등 Statistics... 등)의 다양한 솔루션을 활용하여 서비스 개발 경험자 2) Java, Python 등 프로그래밍 개발 경험 보유자 3) Container 기반 서비스..."
https://kr.indeed.com/viewjob?jk=b86da88c2546f564,"Software Engineer, University Graduate",Google 4.3 서울,,"languages, including... limited to: Java, C/C++, Python, JavaScript, or Go. Experience working with one or more from..."
https://kr.indeed.com/viewjob?jk=089931931a0474d5,소형전지사업부/기술혁신센터,삼성SDI 3.9 충청남도 천안,,"천안 전공분야 - 컴퓨터/시스템 전자/전기 기계/산공 전문지식 - Java, C#, C++, Python - Oracle (PL/SQL) - Automod, VisualComponent - 통신프로그래밍 경험..."
https://kr.indeed.com/viewjob?jk=6aebabcddef7f514,Field Application Engineer,Nearfield Instruments 경기도 용인,,"troubleshooting. Preferably to have coding capability (Matlab, Python...etc... data analysis, visualization, and algorithm..."
https://kr.indeed.com/viewjob?jk=046c7e4a3e9228c1,루티너리데이터 분석가 전세계 50만 명의 일상 바꿉니다,루티너리 서울 서초구,,"BigQuery에서 SQL쿼리를 하기도 하고요. 정제한 데이터는 Python, R 등 익숙한 환경에서도 물론 분석할 수 있고, 데이터 파이프라인에... Redshift 등), Python(Pandas), R, Excel 등을..."
https://kr.indeed.com/viewjob?jk=649ccf047c868778,"금융 데이터 분석 엔진, 로보어드바이저 개발자",에스비씨엔 서울 영등포구,,"시스템, 머신러닝, 자연어처리. 패턴분석 - 다음 언어에서 최소 한 가지 이상 능숙자: Java, C++, Python, JavaScript 우대사항 - 석사이상 컴퓨터공학 (Computer Science) 분야 또는..."
https://kr.indeed.com/viewjob?jk=a0dda478567db352,"(주)트윔 개발자(경력직) 빅데이터,영상처리,머신비전/AI 딥러닝",트윔 경기도 화성,,"자기주도적으로 진행한 경험 - Python/C/C++ 능통자 - 데이터... RNN 등 딥러닝 이론 및 알고리즘 유경험자 - C/C++, Java, Python/TensorFlow/Caffe 사용가능자 - Matlab/R 분석..."
https://kr.indeed.com/viewjob?jk=6b87cf36ef9a9f9e,[신규 프로젝트] Back-End 프로그래머 모십니다.,엔씨소프트 2.7 성남 판교역,,"Framework(Spring Boot)또는 Node.js 이용한 Application 개발 경험자 2. Python, Javascript 등의 스크립트 활용 3. mongoDB, mysql 개발 경험자 4. 최신 기술 동향..."
https://kr.indeed.com/viewjob?jk=8783f7aed2707754,프론트앤드 개발,Nexon 성남 분당구,,"UX에 대한 지속적인 관심 - 더 나은 코드를 위해 노력하시는 분 - Spring, Node.js, Python 등 한 가지 이상의 백엔드 기술에 대한 이해 - TypeScript 경험자 우대 - 프로젝트 설정부터..."
https://kr.indeed.com/viewjob?jk=b0a6480d9ba97da1,전 분야 R&D 개발자 (병역특례자),스칼라웍스 서울 금천구,"연봉 30,000,000원 - 32,000,000원","Development 관련 개발 2) Data Analysis 업무 (R, SQL 등의 활용) 3) Python Application 관련 개발 업무 4) 전산 이론 기초 (Data Structure, Algorithm) 5..."
https://kr.indeed.com/viewjob?jk=d83fc0dd2641f483,전문연구요원 (병역특례) 수시 (AI / SW 분야),딥엑스 성남 분당구,"연봉 40,000,000원 - 100,000,000원",요구 능력] - ASM/C/C++/ Python 언어 코딩 기술 - 운영체제... 경험 - Windows/Linux 상에서 C++/ Python 언어 사용 개발 경험 - C++ / Python 언어 사용 개발 경험 - 객체지향 설계에...
https://kr.indeed.com/viewjob?jk=b3bad30597277db5,금융 AI 기술 연구 개발자 모집,엔씨소프트 2.7 성남 판교역,,"및 연구/문제 해결 능력 - Python 언어에 능숙하신 분 2. 해당직... Recognition, Data/Text Mining 경험 보유 - Python, SQL 활용 우대사항 - AI 관련 전공자 - 금융 도메인에 대한..."
https://kr.indeed.com/viewjob?jk=6ac83986c1779aee,프로그래머 (어플리케이션 개발자 또는 웹개발자),오너클랜 서울 금천구,,인터넷·IT·통신·모바일·게임>응용프로그래머>자바스크립트|인터넷·IT·통신·모바일·게임>응용프로그래머> Python|인터넷·IT·통신·모바일·게임>응용프로그래머>C#|인터넷·IT·통신·모바일·게임>웹프로그래머>웹개발|인터넷...
https://kr.indeed.com/viewjob?jk=83f9ed690d907b50,(주)오픈시스넷 딥러닝 개발자 정규직,오픈시스넷 성남 분당구,,"직책: 대리, 팀원 [자격요건]경력사항: 경력(3년 이상 )학력사항: 대학교(4년)졸업 이상우대사항 : - Python 개발 가능자- 딥러닝 프레임워크 기반 지식 보유자- OpenCV, NumPy, SciPy 라이브러리 지식..."
https://kr.indeed.com/viewjob?jk=41bfd674f66c0c14,[KSTEC] RPA 시스템 개발 경력사원,지식시스템 성남 분당구,,통신·모바일·게임>웹프로그래머>JAVA|인터넷·IT·통신·모바일·게임>웹프로그래머>.NET|인터넷·IT·통신·모바일·게임>웹프로그래머> Python|인터넷·IT·통신·모바일·게임>웹프로그래머>HTML·DHTML·mHTML
https://kr.indeed.com/viewjob?jk=98a0ea3726575729,글로벌주식운용팀 경력사원 안내 (~6/4),삼성자산운용 대한민국,,"량분석(Quantitative Analysis)을 통한 개별주식 운용 전략 개발 및 운용 경력(필수) - Python, VBA 등의 프로그래밍 언어를 통한 개발 능력 및 MS SQL 등의 데이터베이스 연계 프로그래밍 경력자..."
https://kr.indeed.com/viewjob?jk=b102b3d8f193a4c1,2021 GEDP (Global Engineering Developmen...,GE Appliances 경기도 성남,,using C programming language Scripting languages like Lua/ Python/JavaScript may also be used if needed Support connected...
https://kr.indeed.com/viewjob?jk=dda4f419ad70cb8a,솔루션 개발 경력사원 채용,한화그룹 4.2 서울,,"Python 및 기타 프로그래밍 언어 능숙자(C/C++/C#/Java/PHP) 윈도우 및 리눅스 운영체제 활용 능숙자 IP 네트워크, 운영체제, 데이터베이스 등 CS 기본 지식 서버사이드스크립트( Python/PHP..."
https://kr.indeed.com/viewjob?jk=3f8e87e291ecd55a,"화공 신입 정규직, 인턴",에이피에스티 서울 강서구,"연봉 30,000,000원 - 35,000,000원",Python 등 프로그램에 관심자 우대 안녕하세요. ㈜에이피에스티 대표 이덕형입니다.에이피에스티는 생산공장의 안전과 효율을 극대화하는 솔루션을 공급하고 있는 회사로 경쟁력 향상을 위해 자체 솔루션도 정부의 지원과 함께 개발하...
https://kr.indeed.com/viewjob?jk=d76d8d6e70c55fdd,Data Mining Specialist,Thermo Fisher - APAC 3.5 서울,,"Preferably understanding of analytics and business intelligence technologies... R, Python, Power BI or MS AI solutions"
https://kr.indeed.com/viewjob?jk=39ccd72cab530083,의료기기 기구설계 정규직,다인그룹 경기도 김포,,"험자• 이미지 가공 및 처리 경험자• 하드웨어 입력 처리 경험자• 경력: 3년~10년[우대사항]• Java, Python, C++, C# 최소한 한가지 이상의 주요 언어에 능통하신 분• PACS, DICOM, HL7 등 의료..."
https://kr.indeed.com/viewjob?jk=ae185a03d7b8f71e,"사물인터넷(IoT) 개발, 메카트로닉스 외 신입/경력 정규직",리쉐니에 수원 영통구,,"연구 빅데이터분석 및 AI개발 Python , WebRTC 프로그램개발... AI개발, Python / WebRTC프로그램개발 [우대사항] 전공계열: 공학계열 자격증: Python, Python 교육이수자, 빅데이터, 스마트공..."
https://kr.indeed.com/viewjob?jk=99caa544c92c8018,에프앤가이드 - 각 부문 (전문연구요원 포함),에프앤가이드 대한민국,,"우대사항 : ㆍ SQL, python, R 개발경험 소유자 디지털금융팀... 경험 ㆍ개인자산관리(PB) 경험 ㆍB2C 컨텐츠 기획 및 개발 경험 Python, R, Tensorflow, Keras 개발 가능 ㆍ머신러닝/딥러닝..."
https://kr.indeed.com/viewjob?jk=435ab3980bfe52fe,빅데이터 엔지니어,케이뱅크은행 서울 중구,,통신·모바일·게임>빅데이터·AI(인공지능)>머신러닝|인터넷·IT·통신·모바일·게임>빅데이터·AI(인공지능)> Python|인터넷·IT·통신·모바일·게임>전산·IT기술지원>IT기술지원|인터넷·IT·통신·모바일·게임>응용프로그래머...
https://kr.indeed.com/viewjob?jk=1e974ff27c6eb340,Autonomous Driving 분야 엔지니어,포티투닷 서울 강남구,,"프로그래밍 기술 (C/C++, Python 등) - 이동 로봇/드론 관련... platform 개발 경험 - 뛰어난 프로그래밍 기술 (C/C++, Python) - 3D geometry, math, physics 관련 경험 및..."
https://kr.indeed.com/viewjob?jk=b732fb33829bcacb,(대기업) 비파괴 검사/평가,인코리아 프로페셔널 창원 성산구,,"기술개발 또는 실무 - 프로그래밍 및 데이터분석 (Matlab, Python, C/C++/C# 중 1개 이상) 중급이상 [Optional] - 초음파... 통신·모바일·게임>응용프로그래머> Python|인터넷·IT·통신·모바일·게임..."
https://kr.indeed.com/viewjob?jk=68ebd25161b59749,소프트웨어 프로그램 개발자,그림 경기도 광명,"연봉 33,000,000원 - 50,000,000원","직무내용] Python:Deep learning S/W 개발Visual... level imageprocessing)Jave;Ul program, python / C++검사프로그램과 통신공학계열, 해당 직무 경험, 정보처리기사..."
https://kr.indeed.com/viewjob?jk=e97e5ff34697d5a9,[KRAFTON] 음성 (TTS/STT) 딥러닝 엔지니어,PUBG 서울,,험을 보유하신 분 독창적인 기술 제시 및 문제 해결을 위한 프로그래밍 능력을 보유하신 분 (C/C++/ Python/shell 등) 오픈소스 기반 딥 러닝 프레임워크 활용 능력을 보유하신 분 (PyTorch/TensorFlow...
https://kr.indeed.com/viewjob?jk=87ab18830426d480,"드론솔루션 (아두이노 등 임베디드SW, 드론 ICT, 3D)",탱고드론 성남 분당구,"연봉 25,000,000원 - 30,000,000원","학력사항: 학력무관직무기술: 드론솔루션, 아두이노 등 임베디드SW, Python, 택배드론, 국방드론 무기체계, 드론HW제작, 원격수질측정드론, 화재... 통신·모바일·게임>응용프로그래머> Python|인터넷·IT·통신·모바일·게임..."
https://kr.indeed.com/viewjob?jk=4d62f108017056a2,백엔드개발 인공지능바이오제약코스닥기업,대한민국,,"선과 신규 서비스의 UI, 기능을 설계 및 개발"" ※ 자격조건 - python 개발 경험(기본) - non-sql DB, sql DB 중 1개 이상... 사용 경험 - 풀스택 개발자 - python, C# 동시 사용"" 기타정보..."
https://kr.indeed.com/viewjob?jk=1d89fe4b37ab05ed,"데이터마이닝, 빅데이터 큐레이터 외 신입/경력 정규직",에임즈인터내셔널코리아 서울 강남구,,"있거나 이에 준하는 실질적인 기술 경력 -데이터를 다루기 위한 Python 혹은 R 등의 프로그래밍 능력 -SQL의 사용 능력 -데이터를 다루기 위한 Python, R, Java 중 1개의 프로그래밍 능력 -대용량 데이터..."
https://kr.indeed.com/viewjob?jk=87309d3ff40ead61,딥러닝 AI 개발 연구원,베이리스 성남 수정구,,시스템프로그래머>임베디드(Embedded)|인터넷·IT·통신·모바일·게임>응용프로그래머>C·C++|인터넷·IT·통신·모바일·게임>응용프로그래머>Linux|인터넷·IT·통신·모바일·게임>빅데이터·AI(인공지능)> Python
https://kr.indeed.com/viewjob?jk=f94ac3f1ca1d9088,인공지능개발자 및 웹 개발,애니로직 서울 금천구,,"직무내용] 인공지능을 개발 할 수 있는 인재를 구인합니다. Python으로 개발합니다.웹은 Java, javascript를 사용합니다.주 40시간가산디지털 단지내 [근무시간 및 형태] 주 5일 근무 (오전) 9시 00분~(오후..."
https://kr.indeed.com/viewjob?jk=1d15e5adc115c979,서비스 개발 및 운영 관리,아이엠비디엑스 서울 금천구,,"jquery, apache http server, mariadb, python, django주요업무서비스 개발 및 인프라 운영 관리백엔드 - 서버... 업무 및 개발 경험자 Python, django, Java 및..."
https://kr.indeed.com/viewjob?jk=f167a69d1680b2ed,"[펜타시큐리티] 보안S/W 개발 및 기획자 (웹, 인증, 블록체인)",펜타시큐리티시스템 서울 영등포구,,인터넷·IT·통신·모바일·게임>웹프로그래머>JAVA|인터넷·IT·통신·모바일·게임>웹프로그래머> Python|인터넷·IT·통신·모바일·게임>응용프로그래머>C·C++|인터넷·IT·통신·모바일·게임>응용프로그래머>JAVA|인터넷...
https://kr.indeed.com/viewjob?jk=2ba9d984a21e03b1,[전문연구요원] R&D 부문 개발자 병역특례,스칼라웍스 서울 금천구,,"Data Analysis (R, SQL 등의 활용 능력 우대)3) Python Application 관련 개발 업무 (코딩 또는 문제해결) 4) ML... 게임>빅데이터·AI(인공지능)> Python|인터넷·IT·통신·모바일·게임..."
https://kr.indeed.com/viewjob?jk=3a30d4c7e59435c7,제주 국제학교 영어교육도시 위치 컴퓨터 전문 교육기관,스마트에듀학원 서귀포 서귀포시,,"2년수료증 제출가능자- 컴퓨터 전공, 디자인전공자 우대- 엔트리, 스크래치 블럭코딩, PPT 강사 1명- Python, Java, C언어와 같은 프로그램 강사 1명- 포토샵, 일러스트, 프리미어 강사 1명- 디지털아트, 라인..."
https://kr.indeed.com/viewjob?jk=0b05f7fff851371a,게임 런처 개발,Nexon 성남 분당구,,르고 안정적으로 게임을 실행할 수 있도록 함께 고민하고 개발하실 분을 찾습니다. 지원자격 - C++ 혹은 Python 프로그래밍 언어 능숙자 - 비동기 및 병렬처리 프로그래밍 경험 우대사항 - Modern C++ (11...
https://kr.indeed.com/viewjob?jk=41a3c612bb095e66,"경력직원 수시 (IT본부, 대체투자본부)",KIS채권평가 대한민국,,"개발 및 운영 -Django( Python)으로 개발된 시스템 운영 *필요... 서버의 관리 경험 - CD/CI에 대한 구성/관리 경험 - VBA, Python 개발 경험 (2) 모집부서: <대체투자본부> *포지션: 경력 *담당..."
https://kr.indeed.com/viewjob?jk=ce7849f8b35e1c3e,Technical Enablement Manager,DataDog 서울,,"Kubernetes or Rancher etc.. Scripting languages like Python, Javascript, Ruby, Perl, Go, PHP, or Chef/Puppet etc.. Why You..."
https://kr.indeed.com/viewjob?jk=1a75ce748c5f24e9,TOAST CAM 임베디드 개발,NHN 4.4 성남 판교역,,"또는 석사 학위 또는 그에 준하는 실무 경험자 (신입 지원가능) - 임베디드 환경에서 영상 처리 경험자 - Python, C++ 개발 경험 - 딥러닝 프레임워크, 컴퓨터 비젼 경험자 - Visual Object..."
https://kr.indeed.com/viewjob?jk=a64e1e21f61265ce,각 분야별 인재 Pool 등록,지투알 서울,,"자 - 데이터 분석 툴(Adobe Analytics 또는 Google Analytics) 유경험자 우대 - Python, R, SQL 역량 보유자 우대 - 데이터에 기반한 문제해결 능력 및 통계학적 지식 보유자 우대 - 담당..."
https://kr.indeed.com/viewjob?jk=9adbc290202846e1,[아이브릭스] 기업부설연구소 전문연구요원,아이브릭스 성남 분당구,,모바일·게임>응용프로그래머>JAVA|인터넷·IT·통신·모바일·게임>응용프로그래머>자바스크립트|인터넷·IT·통신·모바일·게임>빅데이터·AI(인공지능)>머신러닝|인터넷·IT·통신·모바일·게임>빅데이터·AI(인공지능)> Python
https://kr.indeed.com/viewjob?jk=e85e6f29a6b0e5f2,"SW개발, 시스템유지보수 외 신입/경력 정규직",다올플러스 대구,"연봉 25,000,000원 - 30,000,000원",그래머>JSP|인터넷·IT·통신·모바일·게임>웹프로그래머>JAVA|인터넷·IT·통신·모바일·게임>웹프로그래머> Python|인터넷·IT·통신·모바일·게임>웹프로그래머>HTML·DHTML·mHTML|인터넷·IT·통신·모바일·게임...
https://kr.indeed.com/viewjob?jk=d917ed88ea21fd17,[ 아이콘트롤스 ] 2020년 경력 직원 (기술연구소) 연구개발부문,HDC아이콘트롤스 성남 분당구,,게임>응용프로그래머> Python|인터넷·IT·통신·모바일·게임>응용프로그래머>Android|인터넷·IT·통신·모바일·게임>응용프로그래머>iOS|인터넷·IT·통신·모바일·게임>웹프로그래머> Python|인터넷·IT·통신·모바일...
https://kr.indeed.com/viewjob?jk=36c48cb9bc2758cb,매칭 기획,Nexon 성남 분당구,,"경험이 있다면 더 좋습니다. - 확률 및 통계에 대한 기본적인 지식이 있다면 더 좋습니다. - SQL, Python 등을 사용해 기초적인 데이터 분석, 머신러닝 등을 다루는 데에 관심이 있으면 더 좋습니다. - FIFA..."
https://kr.indeed.com/viewjob?jk=cc44a37c1d6e7407,경력직 채용_Quant 리서치팀,한화그룹 4.2 서울,,선호하나 타 전공자도 지원 可) 2. 경력사항: 사원~대리급 - Database활용 및 운영 능력 - Python 패키지 개발 가능자 - 웹기반 시스템 개발 및 운용 능력 - Postgresql 경험자(우대) - Strong...
https://kr.indeed.com/viewjob?jk=e0e37aaebc73dde3,지표구축,아프리카TV 경기도 성남,,"대시보드 플랫폼의 활용이 가능하신분 - 새로운 서비스 출시후 모니터링이나 트랜드 확인이 가능하도록 설계나 지원이 가능하신분 - SQL,Excel,R, Python 등을 이용하여 데이터 추출 또는 분석이 가능하신 분"
https://kr.indeed.com/viewjob?jk=14ed8097b3b4d463,[TGD] Data Scientist 모집,엔씨소프트 2.7 성남 판교역,,"지원자격 학력 : 무관 경력기간 : 3년 ~ 10년 필수조건 DB 성능까지 고려한 SQL 프로그래밍 가능자 Python을 이용한 데이터 분석 3년 이상 경력자 (SAS, SPSS 등 통계툴만 사용 가능한 경우 제외) 대용량..."
https://kr.indeed.com/viewjob?jk=750c98eeab414ede,Senior DBA – BI (Korea),FPT Software 대한민국,,"CSV Experience with other technologies... Java, Python, .NET, Node.js, and Oracle APEX. Skill requirement: Ability..."
https://kr.indeed.com/viewjob?jk=8af2e47298c6f85b,SAP HANA Quality Specialist,SAP 4.3 서울,,"discipline Preferred skills Knowledge of LINUX Knowledge of Python/shell-Scripting, C/C++ Using C++-Debuggers (like GDB..."
https://kr.indeed.com/viewjob?jk=e8a4630bec0783e8,2021 Market Data Analyst - Seoul,Bloomberg 서울,,"work experience using one more programming language... Python, SQL and R Fluency in Korean and English (both spoken..."
https://kr.indeed.com/viewjob?jk=f78288e880673af0,Software Engineer - Test,Roku 서울,,"experience... least one of following programming languages: Python, Ruby, Java, C++. Experience in multiple languages..."
https://kr.indeed.com/viewjob?jk=2ad85b06dc1bc1a4,Software Quality Engineer,Electronic Arts 서울,,"process improvements Strong scripting experience with Python, Shell Scripts, Ruby, etc. Familiarity with mobile/online game..."
https://kr.indeed.com/viewjob?jk=489f19028e8a723b,통합인터페이스 백엔드 서버 개발,Nexon 성남 분당구,,"게임 빅데이터 실시간 처리 시스템 개발 지원자격 - 백엔드 서버 개발 경력 3년 이상 - Java, Python, Javascript 중 1개 이상의 프로그래밍 경험 - HTTP API 설계 및 개발 경험 - MSA..."
https://kr.indeed.com/viewjob?jk=43f8edb38c7888c7,위메프오 서버개발자(정규직),위메프 2.8 대한민국,,"데이터베이스 분산설계 및 미들웨어 개발 [자격사항] - 서버 프로그래밍 언어(PHP, Go, C/C++, Python, Java) 중 1개 이상 사용이 가능한 분 - 자료구조, 알고리즘, 분산처리 등 SW관련 기본지식 보유..."
https://kr.indeed.com/viewjob?jk=d0ca27a97ddf91f9,엔미디어플랫폼 데이터베이스 관리자 (DBA) 인재 안내,리더스소프트 성남 분당구,,"운영 가능한 분 - DB관련 자격증 보유한 분 - 운영 자동화 스크립트(PowerShell, Shell, Python) 작성 가능한 분 - MongoDB, Redis에 관심 있으신 분 기타사항 - 서류 접수 이후 4주 이내로..."
https://kr.indeed.com/viewjob?jk=d736ed8b3142b924,Software Engineer - Embedded,GE Appliances 경기도 성남,,"C (must have) and C++(optional), lua(optional), python(optional) and Object Oriented Programming. Deep knowledge..."
https://kr.indeed.com/viewjob?jk=d69b5a1e60c65ce6,데이터 마케팅 경력사원,LG전자 3.8 서울 영등포구,,"능력 보유자 (SQL, R, Python, Scalar, Hadoop 등... 운영 경험자 - CRM 캠페인 기획/운영 경험자 - SQL, R, Python 등 통계 패키지 활용 자격증 보유자 모집기한: ~ 본 포지션 채용 시점..."
https://kr.indeed.com/viewjob?jk=1bd431b365bb2f77,데이터 분석 전문가,토이스미스 서울 강남구,"연봉 30,000,000원 - 40,000,000원","개발2. 분석 플랫폼 구축 프로젝트에 참여- 데이터의 수집 기획, 테스트, 실행, 개선[자격요건]- R과 Python 사용 능력- 통계, 데이터 마이닝, 데이터 모델링에 대한 이해 및 경험- MySQL, NoSQL 등 데이터..."
https://kr.indeed.com/viewjob?jk=833a4d9bb5840b70,Senior Data Scientist (Korea),FPT Software 대한민국,,"deploy custom code in a variety of environments ( Python, SAS, R, etc.) to create predictive analytics applications. Use..."
https://kr.indeed.com/viewjob?jk=e27c921dfbf357ac,네이버 클라우드 플랫폼 기술지원,NIT Service 성남 삼평동,,"클라우드 서비스 운영 경험 (AWS, Azure, KT Cloud 등) - Shell Script, Python 활용 가능 - 국가보훈대상자 및 장애인은 법령에 의거 우대 (※입사지원 시 보훈/장애사항 체크 필수..."
https://kr.indeed.com/viewjob?jk=fc037709d0770796,System SW 엔지니어,딥엑스 성남 분당구,"연봉 40,000,000원 - 100,000,000원",사항: 대학교(4년)졸업 이상 [기본 요구능력] - ASM/C/C++/ Python 언어 코딩 기술 - 운영체제 SW 설계 및 구현 - 알고리즘/네트워... 게임>빅데이터·AI(인공지능)> Python|인터넷·IT·통신·모바일·게임...
https://kr.indeed.com/viewjob?jk=b3a6c83c9debcb92,네이버 파이낸셜 플랫폼 운영,NIT Service 성남 삼평동,,"Docker(kubernetes) 및 어플리케이션 배포 전략 지식 보유 - Shell script, python 및 web framework 등 기타 프로그래밍 언어 활용 가능 - 국가보훈대상자 및 장애인은 법령에 의거..."
https://kr.indeed.com/viewjob?jk=af1b1800c6df998a,침해시도 분석/대응 전문가,이베이 코리아 서울 강남구,,"경험 - Firewall/IPS/Botnet 탐지 솔루션 구축/운영 경험 - 업무 자동화를 위한 개발 ( Python 등) 스킬 보유 - Splunk, Elastic 활용 경험 - Private/Public Cloud 환경의..."
https://kr.indeed.com/viewjob?jk=7cb5c3076d1701db,"Field Applications Engineer, Audio",Dolby 서울,,"High level or detailed knowledge of SOC design. C/C++, python coding skills. Knowledge of music, audio/video production..."
https://kr.indeed.com/viewjob?jk=79ac23969bbd20ba,Computer Vision 개발자,인텔리코리아 서울 금천구,,채용이 취소될 수 있습니다. 인터넷·IT·통신·모바일·게임>빅데이터·AI(인공지능)>머신러닝|인터넷·IT·통신·모바일·게임>빅데이터·AI(인공지능)>딥러닝|인터넷·IT·통신·모바일·게임>빅데이터·AI(인공지능)> Python
